,Date,Year,Month,Day,lookup,Day of Week,Category,Aircraft Type,# of Aircraft,Location,Tail Numbers,Night,Notes,Source,Map
0,9/9/2020,2020,9,9,4,Wednesday,*Unspecified,*Unspecified,10,unk,,,"unspecified mix of SU-30 and J-10, 21 total violations from 9/9 - 9/10, unknown how many per day, approximated based on total",https://www.mnd.gov.tw/English/Publish.aspx?title=News%20Channel&SelectStyle=Defense%20News%20&p=77571 and https://focustaiwan.tw/politics/202009100024  ,
1,9/10/2020,2020,9,10,5,Thursday,*Unspecified,*Unspecified,11,unk,,,"unspecified mix of SU-30 and Y-8, 21 total violations from 9/9 - 9/10, unknown how many per day, approximated based on total",https://www.mnd.gov.tw/English/Publish.aspx?title=News%20Channel&SelectStyle=Defense%20News%20&p=77574  and https://focustaiwan.tw/politics/202009100024 ,
2,9/16/2020,2020,9,16,4,Wednesday,ASW,Y-8 ASW,2,Southwest ADIZ,,,,https://www.mnd.gov.tw/Publish.aspx?p=77345&title=%e5%9c%8b%e9%98%b2%e6%b6%88%e6%81%af&SelectStyle=%e5%8d%b3%e6%99%82%e8%bb%8d%e4%ba%8b%e5%8b%95%e6%85%8b,
3,9/18/2020,2020,9,18,6,Friday,Bomber,H-6,2,Southwest ADIZ,,,,https://www.mnd.gov.tw/Publish.aspx?p=77350&title=%e5%9c%8b%e9%98%b2%e6%b6%88%e6%81%af&SelectStyle=%e5%8d%b3%e6%99%82%e8%bb%8d%e4%ba%8b%e5%8b%95%e6%85%8b,
4,9/18/2020,2020,9,18,6,Friday,Fighter,J-16,4,Southwest ADIZ,,,assumed equal split of total sorties for southwest and median line,https://www.mnd.gov.tw/Publish.aspx?p=77350&title=%e5%9c%8b%e9%98%b2%e6%b6%88%e6%81%af&SelectStyle=%e5%8d%b3%e6%99%82%e8%bb%8d%e4%ba%8b%e5%8b%95%e6%85%8b,
5,9/18/2020,2020,9,18,6,Friday,Fighter,J-16,4,Median line,,,assumed equal split of total sorties for southwest and median line,https://www.mnd.gov.tw/Publish.aspx?p=77350&title=%e5%9c%8b%e9%98%b2%e6%b6%88%e6%81%af&SelectStyle=%e5%8d%b3%e6%99%82%e8%bb%8d%e4%ba%8b%e5%8b%95%e6%85%8b,
6,9/18/2020,2020,9,18,6,Friday,Fighter,J-10,4,Median line,,,,https://www.mnd.gov.tw/Publish.aspx?p=77350&title=%e5%9c%8b%e9%98%b2%e6%b6%88%e6%81%af&SelectStyle=%e5%8d%b3%e6%99%82%e8%bb%8d%e4%ba%8b%e5%8b%95%e6%85%8b,
7,9/18/2020,2020,9,18,6,Friday,Fighter,J-11,4,Median line,,,,https://www.mnd.gov.tw/Publish.aspx?p=77350&title=%e5%9c%8b%e9%98%b2%e6%b6%88%e6%81%af&SelectStyle=%e5%8d%b3%e6%99%82%e8%bb%8d%e4%ba%8b%e5%8b%95%e6%85%8b,
8,9/19/2020,2020,9,19,7,Saturday,Fighter,J-16,6,Southwest ADIZ,,,assumed equal split of total sorties for southwest and median line,https://www.mnd.gov.tw/Publish.aspx?p=77351&title=%e5%9c%8b%e9%98%b2%e6%b6%88%e6%81%af&SelectStyle=%e5%8d%b3%e6%99%82%e8%bb%8d%e4%ba%8b%e5%8b%95%e6%85%8b,
9,9/19/2020,2020,9,19,7,Saturday,Fighter,J-16,6,Median line,,,assumed equal split of total sorties for southwest and median line,https://www.mnd.gov.tw/Publish.aspx?p=77351&title=%e5%9c%8b%e9%98%b2%e6%b6%88%e6%81%af&SelectStyle=%e5%8d%b3%e6%99%82%e8%bb%8d%e4%ba%8b%e5%8b%95%e6%85%8b,
10,9/19/2020,2020,9,19,7,Saturday,Fighter,J-10,2,Median line,,,,https://www.mnd.gov.tw/Publish.aspx?p=77351&title=%e5%9c%8b%e9%98%b2%e6%b6%88%e6%81%af&SelectStyle=%e5%8d%b3%e6%99%82%e8%bb%8d%e4%ba%8b%e5%8b%95%e6%85%8b,
11,9/19/2020,2020,9,19,7,Saturday,Fighter,J-11,2,Median line,,,,https://www.mnd.gov.tw/Publish.aspx?p=77351&title=%e5%9c%8b%e9%98%b2%e6%b6%88%e6%81%af&SelectStyle=%e5%8d%b3%e6%99%82%e8%bb%8d%e4%ba%8b%e5%8b%95%e6%85%8b,
12,9/19/2020,2020,9,19,7,Saturday,Bomber,H-6,2,Southwest ADIZ,,,,https://www.mnd.gov.tw/Publish.aspx?p=77351&title=%e5%9c%8b%e9%98%b2%e6%b6%88%e6%81%af&SelectStyle=%e5%8d%b3%e6%99%82%e8%bb%8d%e4%ba%8b%e5%8b%95%e6%85%8b,
13,9/19/2020,2020,9,19,7,Saturday,ASW,Y-8 ASW,1,Southwest ADIZ,,,,https://www.mnd.gov.tw/Publish.aspx?p=77351&title=%e5%9c%8b%e9%98%b2%e6%b6%88%e6%81%af&SelectStyle=%e5%8d%b3%e6%99%82%e8%bb%8d%e4%ba%8b%e5%8b%95%e6%85%8b,
14,9/21/2020,2020,9,21,2,Monday,ASW,Y-8 ASW,2,Southwest ADIZ,,,"PRC MFA Spokesperson: ""The Taiwan region is an inalienable part of China's territory. The so-called 'median line' is non-existent."" https://www.fmprc.gov.cn/mfa_eng/xwfw_665399/s2510_665401/t1816753.shtml ",https://www.mnd.gov.tw/Publish.aspx?p=77356&title=%e5%9c%8b%e9%98%b2%e6%b6%88%e6%81%af&SelectStyle=%e5%8d%b3%e6%99%82%e8%bb%8d%e4%ba%8b%e5%8b%95%e6%85%8b,
15,9/22/2020,2020,9,22,3,Tuesday,ASW,Y-8 ASW,2,Southwest ADIZ,,,,https://www.mnd.gov.tw/Publish.aspx?p=77360&title=%e5%9c%8b%e9%98%b2%e6%b6%88%e6%81%af&SelectStyle=%e5%8d%b3%e6%99%82%e8%bb%8d%e4%ba%8b%e5%8b%95%e6%85%8b,
16,9/23/2020,2020,9,23,4,Wednesday,ASW,Y-8 ASW,2,Southwest ADIZ,,,,https://www.mnd.gov.tw/Publish.aspx?p=77362&title=%e5%9c%8b%e9%98%b2%e6%b6%88%e6%81%af&SelectStyle=%e5%8d%b3%e6%99%82%e8%bb%8d%e4%ba%8b%e5%8b%95%e6%85%8b,
17,9/24/2020,2020,9,24,5,Thursday,ASW,Y-8 ASW,1,Southwest ADIZ,,,,https://www.mnd.gov.tw/Publish.aspx?p=77363&title=%e5%9c%8b%e9%98%b2%e6%b6%88%e6%81%af&SelectStyle=%e5%8d%b3%e6%99%82%e8%bb%8d%e4%ba%8b%e5%8b%95%e6%85%8b,
18,9/29/2020,2020,9,29,3,Tuesday,ASW,Y-8 ASW,2,Southwest ADIZ,,,,https://www.mnd.gov.tw/Publish.aspx?p=77393&title=%e5%9c%8b%e9%98%b2%e6%b6%88%e6%81%af&SelectStyle=%e5%8d%b3%e6%99%82%e8%bb%8d%e4%ba%8b%e5%8b%95%e6%85%8b,
19,10/1/2020,2020,10,1,5,Thursday,ASW,Y-8 ASW,1,Southwest ADIZ,,,,https://www.mnd.gov.tw/Publish.aspx?p=77401&title=%e5%9c%8b%e9%98%b2%e6%b6%88%e6%81%af&SelectStyle=%e5%8d%b3%e6%99%82%e8%bb%8d%e4%ba%8b%e5%8b%95%e6%85%8b,
20,10/3/2020,2020,10,3,7,Saturday,ASW,Y-8 ASW,1,Southwest ADIZ,,,,https://www.mnd.gov.tw/Publish.aspx?p=77428&title=%e5%9c%8b%e9%98%b2%e6%b6%88%e6%81%af&SelectStyle=%e5%8d%b3%e6%99%82%e8%bb%8d%e4%ba%8b%e5%8b%95%e6%85%8b,
21,10/4/2020,2020,10,4,1,Sunday,ASW,Y-8 ASW,1,Southwest ADIZ,,,,https://www.mnd.gov.tw/Publish.aspx?p=77436&title=%e5%9c%8b%e9%98%b2%e6%b6%88%e6%81%af&SelectStyle=%e5%8d%b3%e6%99%82%e8%bb%8d%e4%ba%8b%e5%8b%95%e6%85%8b,
22,10/6/2020,2020,10,6,3,Tuesday,ASW,Y-8 ASW,1,Southwest ADIZ,,,,https://www.mnd.gov.tw/Publish.aspx?p=77441&title=%e5%9c%8b%e9%98%b2%e6%b6%88%e6%81%af&SelectStyle=%e5%8d%b3%e6%99%82%e8%bb%8d%e4%ba%8b%e5%8b%95%e6%85%8b,
23,10/7/2020,2020,10,7,4,Wednesday,AEW&C,KJ-500,1,Southwest ADIZ,,,"Came from the south, instead of PRC mainland",https://www.mnd.gov.tw/Publish.aspx?p=77443&title=%e5%9c%8b%e9%98%b2%e6%b6%88%e6%81%af&SelectStyle=%e5%8d%b3%e6%99%82%e8%bb%8d%e4%ba%8b%e5%8b%95%e6%85%8b,
24,10/8/2020,2020,10,8,5,Thursday,ASW,Y-8 ASW,1,Southwest ADIZ,,,,https://www.mnd.gov.tw/Publish.aspx?p=77445&title=%e5%9c%8b%e9%98%b2%e6%b6%88%e6%81%af&SelectStyle=%e5%8d%b3%e6%99%82%e8%bb%8d%e4%ba%8b%e5%8b%95%e6%85%8b,
25,10/9/2020,2020,10,9,6,Friday,Transport,Y-8,1,Southwest ADIZ,,,,https://www.mnd.gov.tw/Publish.aspx?p=77447&title=%e5%9c%8b%e9%98%b2%e6%b6%88%e6%81%af&SelectStyle=%e5%8d%b3%e6%99%82%e8%bb%8d%e4%ba%8b%e5%8b%95%e6%85%8b,
26,10/9/2020,2020,10,9,6,Friday,EW,Y-9 EW,1,Southwest ADIZ,,,"identified in MND report as ""Y-9"", identified as Y-9EW via tail number. I thank Eli Kravinsky for helping determine this",https://www.mnd.gov.tw/Publish.aspx?p=77447&title=%e5%9c%8b%e9%98%b2%e6%b6%88%e6%81%af&SelectStyle=%e5%8d%b3%e6%99%82%e8%bb%8d%e4%ba%8b%e5%8b%95%e6%85%8b,
27,10/10/2020,2020,10,10,7,Saturday,ASW,Y-8 ASW,1,Southwest ADIZ,,,,https://www.mnd.gov.tw/Publish.aspx?p=77448&title=%e5%9c%8b%e9%98%b2%e6%b6%88%e6%81%af&SelectStyle=%e5%8d%b3%e6%99%82%e8%bb%8d%e4%ba%8b%e5%8b%95%e6%85%8b,
28,10/11/2020,2020,10,11,1,Sunday,ASW,Y-8 ASW,1,Southwest ADIZ,,,,https://www.mnd.gov.tw/Publish.aspx?p=77450&title=%e5%9c%8b%e9%98%b2%e6%b6%88%e6%81%af&SelectStyle=%e5%8d%b3%e6%99%82%e8%bb%8d%e4%ba%8b%e5%8b%95%e6%85%8b,
29,10/15/2020,2020,10,15,5,Thursday,ASW,Y-8 ASW,1,Southwest ADIZ,,,,https://www.mnd.gov.tw/Publish.aspx?p=77458&title=%e5%9c%8b%e9%98%b2%e6%b6%88%e6%81%af&SelectStyle=%e5%8d%b3%e6%99%82%e8%bb%8d%e4%ba%8b%e5%8b%95%e6%85%8b,
30,10/16/2020,2020,10,16,6,Friday,ASW,Y-8 ASW,1,Southwest ADIZ,,,,https://www.mnd.gov.tw/Publish.aspx?p=77460&title=%e5%9c%8b%e9%98%b2%e6%b6%88%e6%81%af&SelectStyle=%e5%8d%b3%e6%99%82%e8%bb%8d%e4%ba%8b%e5%8b%95%e6%85%8b,
31,10/17/2020,2020,10,17,7,Saturday,ASW,Y-8 ASW,1,Southwest ADIZ,,,,https://www.mnd.gov.tw/Publish.aspx?p=77462&title=%e5%9c%8b%e9%98%b2%e6%b6%88%e6%81%af&SelectStyle=%e5%8d%b3%e6%99%82%e8%bb%8d%e4%ba%8b%e5%8b%95%e6%85%8b,
32,10/20/2020,2020,10,20,3,Tuesday,AEW&C,KJ-500,1,Southwest ADIZ,,,,https://www.mnd.gov.tw/Publish.aspx?p=77471&title=%e5%9c%8b%e9%98%b2%e6%b6%88%e6%81%af&SelectStyle=%e5%8d%b3%e6%99%82%e8%bb%8d%e4%ba%8b%e5%8b%95%e6%85%8b,
33,10/20/2020,2020,10,20,3,Tuesday,EW,Y-9 EW,1,Southwest ADIZ,,,,https://www.mnd.gov.tw/Publish.aspx?p=77471&title=%e5%9c%8b%e9%98%b2%e6%b6%88%e6%81%af&SelectStyle=%e5%8d%b3%e6%99%82%e8%bb%8d%e4%ba%8b%e5%8b%95%e6%85%8b,
34,10/20/2020,2020,10,20,3,Tuesday,ASW,Y-8 ASW,1,Southwest ADIZ,,,,https://www.mnd.gov.tw/Publish.aspx?p=77471&title=%e5%9c%8b%e9%98%b2%e6%b6%88%e6%81%af&SelectStyle=%e5%8d%b3%e6%99%82%e8%bb%8d%e4%ba%8b%e5%8b%95%e6%85%8b,
35,10/21/2020,2020,10,21,4,Wednesday,ASW,Y-8 ASW,1,Southwest ADIZ,,,,https://www.mnd.gov.tw/Publish.aspx?p=77474&title=%e5%9c%8b%e9%98%b2%e6%b6%88%e6%81%af&SelectStyle=%e5%8d%b3%e6%99%82%e8%bb%8d%e4%ba%8b%e5%8b%95%e6%85%8b,
36,10/25/2020,2020,10,25,1,Sunday,ASW,Y-8 ASW,1,Southwest ADIZ,,,,https://www.mnd.gov.tw/Publish.aspx?p=77477&title=%e5%9c%8b%e9%98%b2%e6%b6%88%e6%81%af&SelectStyle=%e5%8d%b3%e6%99%82%e8%bb%8d%e4%ba%8b%e5%8b%95%e6%85%8b,
37,10/26/2020,2020,10,26,2,Monday,RECCE,Y-8 RECCE,1,Southwest ADIZ,,,,https://www.mnd.gov.tw/Publish.aspx?p=77481&title=%e5%9c%8b%e9%98%b2%e6%b6%88%e6%81%af&SelectStyle=%e5%8d%b3%e6%99%82%e8%bb%8d%e4%ba%8b%e5%8b%95%e6%85%8b,
38,10/26/2020,2020,10,26,2,Monday,ASW,Y-8 ASW,1,Southwest ADIZ,,,,https://www.mnd.gov.tw/Publish.aspx?p=77481&title=%e5%9c%8b%e9%98%b2%e6%b6%88%e6%81%af&SelectStyle=%e5%8d%b3%e6%99%82%e8%bb%8d%e4%ba%8b%e5%8b%95%e6%85%8b,
39,10/27/2020,2020,10,27,3,Tuesday,EW,Y-8 EW,1,Southwest ADIZ,,,,https://www.mnd.gov.tw/Publish.aspx?p=77484&title=%e5%9c%8b%e9%98%b2%e6%b6%88%e6%81%af&SelectStyle=%e5%8d%b3%e6%99%82%e8%bb%8d%e4%ba%8b%e5%8b%95%e6%85%8b,
40,10/28/2020,2020,10,28,4,Wednesday,EW,Y-9 EW,1,Southwest ADIZ,,,,https://www.mnd.gov.tw/Publish.aspx?p=77489&title=%e5%9c%8b%e9%98%b2%e6%b6%88%e6%81%af&SelectStyle=%e5%8d%b3%e6%99%82%e8%bb%8d%e4%ba%8b%e5%8b%95%e6%85%8b,
41,10/28/2020,2020,10,28,4,Wednesday,EW,Y-8 EW,1,Southwest ADIZ,,,4 hours later,https://www.mnd.gov.tw/Publish.aspx?p=77491&title=%e5%9c%8b%e9%98%b2%e6%b6%88%e6%81%af&SelectStyle=%e5%8d%b3%e6%99%82%e8%bb%8d%e4%ba%8b%e5%8b%95%e6%85%8b,
42,10/29/2020,2020,10,29,5,Thursday,EW,Y-9 EW,1,Southwest ADIZ,,,,https://www.mnd.gov.tw/Publish.aspx?p=77492&title=%e5%9c%8b%e9%98%b2%e6%b6%88%e6%81%af&SelectStyle=%e5%8d%b3%e6%99%82%e8%bb%8d%e4%ba%8b%e5%8b%95%e6%85%8b,
43,10/30/2020,2020,10,30,6,Friday,ELINT,Y-8 ELINT,1,Southwest ADIZ,,,,https://www.mnd.gov.tw/Publish.aspx?p=77497&title=%e5%9c%8b%e9%98%b2%e6%b6%88%e6%81%af&SelectStyle=%e5%8d%b3%e6%99%82%e8%bb%8d%e4%ba%8b%e5%8b%95%e6%85%8b,
44,10/30/2020,2020,10,30,6,Friday,EW,Y-8 EW,1,Southwest ADIZ,,,,https://www.mnd.gov.tw/Publish.aspx?p=77497&title=%e5%9c%8b%e9%98%b2%e6%b6%88%e6%81%af&SelectStyle=%e5%8d%b3%e6%99%82%e8%bb%8d%e4%ba%8b%e5%8b%95%e6%85%8b,
45,10/30/2020,2020,10,30,6,Friday,RECCE,Y-8 RECCE,1,Southwest ADIZ,,,,https://www.mnd.gov.tw/Publish.aspx?p=77497&title=%e5%9c%8b%e9%98%b2%e6%b6%88%e6%81%af&SelectStyle=%e5%8d%b3%e6%99%82%e8%bb%8d%e4%ba%8b%e5%8b%95%e6%85%8b,
46,10/31/2020,2020,10,31,7,Saturday,ASW,Y-8 ASW,1,Southwest ADIZ,,,,https://www.mnd.gov.tw/Publish.aspx?p=77498&title=%e5%9c%8b%e9%98%b2%e6%b6%88%e6%81%af&SelectStyle=%e5%8d%b3%e6%99%82%e8%bb%8d%e4%ba%8b%e5%8b%95%e6%85%8b,
47,11/1/2020,2020,11,1,1,Sunday,RECCE,Y-8 RECCE,1,Southwest ADIZ,,,,https://www.mnd.gov.tw/Publish.aspx?p=77501&title=%e5%9c%8b%e9%98%b2%e6%b6%88%e6%81%af&SelectStyle=%e5%8d%b3%e6%99%82%e8%bb%8d%e4%ba%8b%e5%8b%95%e6%85%8b,
48,11/2/2020,2020,11,2,2,Monday,ASW,Y-8 ASW,1,Southwest ADIZ,,,,https://www.mnd.gov.tw/Publish.aspx?p=77506&title=%e5%9c%8b%e9%98%b2%e6%b6%88%e6%81%af&SelectStyle=%e5%8d%b3%e6%99%82%e8%bb%8d%e4%ba%8b%e5%8b%95%e6%85%8b,
49,11/2/2020,2020,11,2,2,Monday,RECCE,Y-8 RECCE,1,Southwest ADIZ,,,,https://www.mnd.gov.tw/Publish.aspx?p=77506&title=%e5%9c%8b%e9%98%b2%e6%b6%88%e6%81%af&SelectStyle=%e5%8d%b3%e6%99%82%e8%bb%8d%e4%ba%8b%e5%8b%95%e6%85%8b,
50,11/2/2020,2020,11,2,2,Monday,Fighter,SU-30,2,Southwest ADIZ,,,,https://www.mnd.gov.tw/Publish.aspx?p=77506&title=%e5%9c%8b%e9%98%b2%e6%b6%88%e6%81%af&SelectStyle=%e5%8d%b3%e6%99%82%e8%bb%8d%e4%ba%8b%e5%8b%95%e6%85%8b,
51,11/2/2020,2020,11,2,2,Monday,Fighter,J-16,2,Southwest ADIZ,,,,https://www.mnd.gov.tw/Publish.aspx?p=77506&title=%e5%9c%8b%e9%98%b2%e6%b6%88%e6%81%af&SelectStyle=%e5%8d%b3%e6%99%82%e8%bb%8d%e4%ba%8b%e5%8b%95%e6%85%8b,
52,11/2/2020,2020,11,2,2,Monday,Fighter,J-10,2,Southwest ADIZ,,,,https://www.mnd.gov.tw/Publish.aspx?p=77506&title=%e5%9c%8b%e9%98%b2%e6%b6%88%e6%81%af&SelectStyle=%e5%8d%b3%e6%99%82%e8%bb%8d%e4%ba%8b%e5%8b%95%e6%85%8b,
53,11/3/2020,2020,11,3,3,Tuesday,ASW,Y-8 ASW,1,Southwest ADIZ,,,,https://www.mnd.gov.tw/Publish.aspx?p=77515&title=%e5%9c%8b%e9%98%b2%e6%b6%88%e6%81%af&SelectStyle=%e5%8d%b3%e6%99%82%e8%bb%8d%e4%ba%8b%e5%8b%95%e6%85%8b,
54,11/4/2020,2020,11,4,4,Wednesday,EW,Y-9 EW,1,Southwest ADIZ,,,,https://www.mnd.gov.tw/Publish.aspx?p=77518&title=%e5%9c%8b%e9%98%b2%e6%b6%88%e6%81%af&SelectStyle=%e5%8d%b3%e6%99%82%e8%bb%8d%e4%ba%8b%e5%8b%95%e6%85%8b,
55,11/5/2020,2020,11,5,5,Thursday,EW,Y-9 EW,1,Southwest ADIZ,,,,https://www.mnd.gov.tw/Publish.aspx?p=77522&title=%e5%9c%8b%e9%98%b2%e6%b6%88%e6%81%af&SelectStyle=%e5%8d%b3%e6%99%82%e8%bb%8d%e4%ba%8b%e5%8b%95%e6%85%8b,
56,11/5/2020,2020,11,5,5,Thursday,EW,Y-8 EW,1,Southwest ADIZ,,,,https://www.mnd.gov.tw/Publish.aspx?p=77522&title=%e5%9c%8b%e9%98%b2%e6%b6%88%e6%81%af&SelectStyle=%e5%8d%b3%e6%99%82%e8%bb%8d%e4%ba%8b%e5%8b%95%e6%85%8b,
57,11/5/2020,2020,11,5,5,Thursday,ASW,Y-8 ASW,1,Southwest ADIZ,,,,https://www.mnd.gov.tw/Publish.aspx?p=77522&title=%e5%9c%8b%e9%98%b2%e6%b6%88%e6%81%af&SelectStyle=%e5%8d%b3%e6%99%82%e8%bb%8d%e4%ba%8b%e5%8b%95%e6%85%8b,
58,11/6/2020,2020,11,6,6,Friday,EW,Y-8 EW,1,Southwest ADIZ,,,,https://www.mnd.gov.tw/Publish.aspx?p=77524&title=%e5%9c%8b%e9%98%b2%e6%b6%88%e6%81%af&SelectStyle=%e5%8d%b3%e6%99%82%e8%bb%8d%e4%ba%8b%e5%8b%95%e6%85%8b,
59,11/10/2020,2020,11,10,3,Tuesday,ASW,Y-8 ASW,1,Southwest ADIZ,,,,https://www.mnd.gov.tw/Publish.aspx?p=77531&title=%e5%9c%8b%e9%98%b2%e6%b6%88%e6%81%af&SelectStyle=%e5%8d%b3%e6%99%82%e8%bb%8d%e4%ba%8b%e5%8b%95%e6%85%8b,
60,11/11/2020,2020,11,11,4,Wednesday,RECCE,Y-8 RECCE,1,Southwest ADIZ,,,,https://www.mnd.gov.tw/Publish.aspx?p=77539&title=%e5%9c%8b%e9%98%b2%e6%b6%88%e6%81%af&SelectStyle=%e5%8d%b3%e6%99%82%e8%bb%8d%e4%ba%8b%e5%8b%95%e6%85%8b,
61,11/11/2020,2020,11,11,4,Wednesday,ASW,Y-8 ASW,1,Southwest ADIZ,,,,https://www.mnd.gov.tw/Publish.aspx?p=77539&title=%e5%9c%8b%e9%98%b2%e6%b6%88%e6%81%af&SelectStyle=%e5%8d%b3%e6%99%82%e8%bb%8d%e4%ba%8b%e5%8b%95%e6%85%8b,
62,11/12/2020,2020,11,12,5,Thursday,ASW,Y-8 ASW,1,Southwest ADIZ,,,,https://www.mnd.gov.tw/Publish.aspx?p=77545&title=%e5%9c%8b%e9%98%b2%e6%b6%88%e6%81%af&SelectStyle=%e5%8d%b3%e6%99%82%e8%bb%8d%e4%ba%8b%e5%8b%95%e6%85%8b,
63,11/14/2020,2020,11,14,7,Saturday,EW,Y-8 EW,1,Southwest ADIZ,,,,https://www.mnd.gov.tw/Publish.aspx?p=77550&title=%e5%9c%8b%e9%98%b2%e6%b6%88%e6%81%af&SelectStyle=%e5%8d%b3%e6%99%82%e8%bb%8d%e4%ba%8b%e5%8b%95%e6%85%8b,
64,11/15/2020,2020,11,15,1,Sunday,ASW,Y-8 ASW,1,Southwest ADIZ,,,,https://www.mnd.gov.tw/Publish.aspx?p=77551&title=%e5%9c%8b%e9%98%b2%e6%b6%88%e6%81%af&SelectStyle=%e5%8d%b3%e6%99%82%e8%bb%8d%e4%ba%8b%e5%8b%95%e6%85%8b,
65,11/15/2020,2020,11,15,1,Sunday,RECCE,Y-8 RECCE,1,Southwest ADIZ,,,,https://www.mnd.gov.tw/Publish.aspx?p=77551&title=%e5%9c%8b%e9%98%b2%e6%b6%88%e6%81%af&SelectStyle=%e5%8d%b3%e6%99%82%e8%bb%8d%e4%ba%8b%e5%8b%95%e6%85%8b,
66,11/16/2020,2020,11,16,2,Monday,EW,Y-8 EW,1,Southwest ADIZ,,,,https://www.mnd.gov.tw/Publish.aspx?p=77588&title=%e5%9c%8b%e9%98%b2%e6%b6%88%e6%81%af&SelectStyle=%e5%8d%b3%e6%99%82%e8%bb%8d%e4%ba%8b%e5%8b%95%e6%85%8b,
67,11/16/2020,2020,11,16,2,Monday,ASW,Y-8 ASW,1,Southwest ADIZ,,,,https://www.mnd.gov.tw/Publish.aspx?p=77588&title=%e5%9c%8b%e9%98%b2%e6%b6%88%e6%81%af&SelectStyle=%e5%8d%b3%e6%99%82%e8%bb%8d%e4%ba%8b%e5%8b%95%e6%85%8b,
68,11/17/2020,2020,11,17,3,Tuesday,EW,Y-8 EW,1,Southwest ADIZ,,,,https://www.mnd.gov.tw/Publish.aspx?p=77592&title=%e5%9c%8b%e9%98%b2%e6%b6%88%e6%81%af&SelectStyle=%e5%8d%b3%e6%99%82%e8%bb%8d%e4%ba%8b%e5%8b%95%e6%85%8b,
69,11/17/2020,2020,11,17,3,Tuesday,ASW,Y-8 ASW,1,Southwest ADIZ,,,,https://www.mnd.gov.tw/Publish.aspx?p=77592&title=%e5%9c%8b%e9%98%b2%e6%b6%88%e6%81%af&SelectStyle=%e5%8d%b3%e6%99%82%e8%bb%8d%e4%ba%8b%e5%8b%95%e6%85%8b,
70,11/18/2020,2020,11,18,4,Wednesday,EW,Y-9 EW,1,Southwest ADIZ,,,,https://www.mnd.gov.tw/Publish.aspx?p=77599&title=%e5%9c%8b%e9%98%b2%e6%b6%88%e6%81%af&SelectStyle=%e5%8d%b3%e6%99%82%e8%bb%8d%e4%ba%8b%e5%8b%95%e6%85%8b,
71,11/18/2020,2020,11,18,4,Wednesday,EW,Y-8 EW,1,Southwest ADIZ,,,,https://www.mnd.gov.tw/Publish.aspx?p=77599&title=%e5%9c%8b%e9%98%b2%e6%b6%88%e6%81%af&SelectStyle=%e5%8d%b3%e6%99%82%e8%bb%8d%e4%ba%8b%e5%8b%95%e6%85%8b,
72,11/18/2020,2020,11,18,4,Wednesday,ASW,Y-8 ASW,1,Southwest ADIZ,,,,https://www.mnd.gov.tw/Publish.aspx?p=77599&title=%e5%9c%8b%e9%98%b2%e6%b6%88%e6%81%af&SelectStyle=%e5%8d%b3%e6%99%82%e8%bb%8d%e4%ba%8b%e5%8b%95%e6%85%8b,
73,11/21/2020,2020,11,21,7,Saturday,RECCE,Y-8 RECCE,1,Southwest ADIZ,,,,https://www.mnd.gov.tw/Publish.aspx?p=77614&title=%e5%9c%8b%e9%98%b2%e6%b6%88%e6%81%af&SelectStyle=%e5%8d%b3%e6%99%82%e8%bb%8d%e4%ba%8b%e5%8b%95%e6%85%8b,
74,11/21/2020,2020,11,21,7,Saturday,ASW,Y-8 ASW,1,Southwest ADIZ,,,,https://www.mnd.gov.tw/Publish.aspx?p=77614&title=%e5%9c%8b%e9%98%b2%e6%b6%88%e6%81%af&SelectStyle=%e5%8d%b3%e6%99%82%e8%bb%8d%e4%ba%8b%e5%8b%95%e6%85%8b,
75,11/22/2020,2020,11,22,1,Sunday,ASW,Y-8 ASW,1,Southwest ADIZ,,,,https://www.mnd.gov.tw/Publish.aspx?p=77617&title=%e5%9c%8b%e9%98%b2%e6%b6%88%e6%81%af&SelectStyle=%e5%8d%b3%e6%99%82%e8%bb%8d%e4%ba%8b%e5%8b%95%e6%85%8b,
76,11/23/2020,2020,11,23,2,Monday,ASW,Y-8 ASW,1,Southwest ADIZ,,,,https://www.mnd.gov.tw/Publish.aspx?p=77623&title=%e5%9c%8b%e9%98%b2%e6%b6%88%e6%81%af&SelectStyle=%e5%8d%b3%e6%99%82%e8%bb%8d%e4%ba%8b%e5%8b%95%e6%85%8b,
77,11/24/2020,2020,11,24,3,Tuesday,ASW,Y-8 ASW,1,Southwest ADIZ,,,,https://www.mnd.gov.tw/Publish.aspx?p=77633&title=%e5%9c%8b%e9%98%b2%e6%b6%88%e6%81%af&SelectStyle=%e5%8d%b3%e6%99%82%e8%bb%8d%e4%ba%8b%e5%8b%95%e6%85%8b,
78,11/24/2020,2020,11,24,3,Tuesday,EW,Y-8 EW,1,Southwest ADIZ,,,,https://www.mnd.gov.tw/Publish.aspx?p=77633&title=%e5%9c%8b%e9%98%b2%e6%b6%88%e6%81%af&SelectStyle=%e5%8d%b3%e6%99%82%e8%bb%8d%e4%ba%8b%e5%8b%95%e6%85%8b,
79,11/25/2020,2020,11,25,4,Wednesday,ASW,Y-8 ASW,1,Southwest ADIZ,,,,https://www.mnd.gov.tw/Publish.aspx?p=77639&title=%e5%9c%8b%e9%98%b2%e6%b6%88%e6%81%af&SelectStyle=%e5%8d%b3%e6%99%82%e8%bb%8d%e4%ba%8b%e5%8b%95%e6%85%8b,
80,11/28/2020,2020,11,28,7,Saturday,ASW,Y-8 ASW,1,Southwest ADIZ,,,,https://www.mnd.gov.tw/Publish.aspx?p=77647&title=%e5%9c%8b%e9%98%b2%e6%b6%88%e6%81%af&SelectStyle=%e5%8d%b3%e6%99%82%e8%bb%8d%e4%ba%8b%e5%8b%95%e6%85%8b,
81,11/28/2020,2020,11,28,7,Saturday,RECCE,Y-8 RECCE,1,Southwest ADIZ,,,,https://www.mnd.gov.tw/Publish.aspx?p=77647&title=%e5%9c%8b%e9%98%b2%e6%b6%88%e6%81%af&SelectStyle=%e5%8d%b3%e6%99%82%e8%bb%8d%e4%ba%8b%e5%8b%95%e6%85%8b,
82,11/29/2020,2020,11,29,1,Sunday,ASW,Y-8 ASW,1,Southwest ADIZ,,,,https://www.mnd.gov.tw/Publish.aspx?p=77649&title=%e5%9c%8b%e9%98%b2%e6%b6%88%e6%81%af&SelectStyle=%e5%8d%b3%e6%99%82%e8%bb%8d%e4%ba%8b%e5%8b%95%e6%85%8b,
83,11/30/2020,2020,11,30,2,Monday,RECCE,Y-8 RECCE,1,Southwest ADIZ,,,,https://www.mnd.gov.tw/Publish.aspx?p=77656&title=%e5%9c%8b%e9%98%b2%e6%b6%88%e6%81%af&SelectStyle=%e5%8d%b3%e6%99%82%e8%bb%8d%e4%ba%8b%e5%8b%95%e6%85%8b,
84,11/30/2020,2020,11,30,2,Monday,EW,Y-8 EW,1,Southwest ADIZ,,,,https://www.mnd.gov.tw/Publish.aspx?p=77656&title=%e5%9c%8b%e9%98%b2%e6%b6%88%e6%81%af&SelectStyle=%e5%8d%b3%e6%99%82%e8%bb%8d%e4%ba%8b%e5%8b%95%e6%85%8b,
85,12/1/2020,2020,12,1,3,Tuesday,ASW,Y-8 ASW,1,Southwest ADIZ,,,,https://www.mnd.gov.tw/Publish.aspx?p=77658&title=%e5%9c%8b%e9%98%b2%e6%b6%88%e6%81%af&SelectStyle=%e5%8d%b3%e6%99%82%e8%bb%8d%e4%ba%8b%e5%8b%95%e6%85%8b,
86,12/2/2020,2020,12,2,4,Wednesday,ASW,Y-8 ASW,1,Southwest ADIZ,,,,https://www.mnd.gov.tw/Publish.aspx?p=77661&title=%e5%9c%8b%e9%98%b2%e6%b6%88%e6%81%af&SelectStyle=%e5%8d%b3%e6%99%82%e8%bb%8d%e4%ba%8b%e5%8b%95%e6%85%8b,
87,12/4/2020,2020,12,4,6,Friday,ASW,Y-8 ASW,1,Southwest ADIZ,,,,https://www.mnd.gov.tw/Publish.aspx?p=77679&title=%e5%9c%8b%e9%98%b2%e6%b6%88%e6%81%af&SelectStyle=%e5%8d%b3%e6%99%82%e8%bb%8d%e4%ba%8b%e5%8b%95%e6%85%8b,
88,12/4/2020,2020,12,4,6,Friday,RECCE,Y-8 RECCE,1,Southwest ADIZ,,,,https://www.mnd.gov.tw/Publish.aspx?p=77679&title=%e5%9c%8b%e9%98%b2%e6%b6%88%e6%81%af&SelectStyle=%e5%8d%b3%e6%99%82%e8%bb%8d%e4%ba%8b%e5%8b%95%e6%85%8b,
89,12/4/2020,2020,12,4,6,Friday,EW,Y-8 EW,1,Southwest ADIZ,,,,https://www.mnd.gov.tw/Publish.aspx?p=77679&title=%e5%9c%8b%e9%98%b2%e6%b6%88%e6%81%af&SelectStyle=%e5%8d%b3%e6%99%82%e8%bb%8d%e4%ba%8b%e5%8b%95%e6%85%8b,
90,12/5/2020,2020,12,5,7,Saturday,ASW,Y-8 ASW,1,Southwest ADIZ,,,,https://www.mnd.gov.tw/Publish.aspx?p=77680&title=%e5%9c%8b%e9%98%b2%e6%b6%88%e6%81%af&SelectStyle=%e5%8d%b3%e6%99%82%e8%bb%8d%e4%ba%8b%e5%8b%95%e6%85%8b,
91,12/5/2020,2020,12,5,7,Saturday,RECCE,Y-8 RECCE,1,Southwest ADIZ,,,,https://www.mnd.gov.tw/Publish.aspx?p=77680&title=%e5%9c%8b%e9%98%b2%e6%b6%88%e6%81%af&SelectStyle=%e5%8d%b3%e6%99%82%e8%bb%8d%e4%ba%8b%e5%8b%95%e6%85%8b,
92,12/6/2020,2020,12,6,1,Sunday,ASW,Y-8 ASW,1,Southwest ADIZ,,,,https://www.mnd.gov.tw/Publish.aspx?p=77681&title=%e5%9c%8b%e9%98%b2%e6%b6%88%e6%81%af&SelectStyle=%e5%8d%b3%e6%99%82%e8%bb%8d%e4%ba%8b%e5%8b%95%e6%85%8b,
93,12/7/2020,2020,12,7,2,Monday,ASW,Y-8 ASW,1,Southwest ADIZ,,,,https://www.mnd.gov.tw/Publish.aspx?p=77687&title=%e5%9c%8b%e9%98%b2%e6%b6%88%e6%81%af&SelectStyle=%e5%8d%b3%e6%99%82%e8%bb%8d%e4%ba%8b%e5%8b%95%e6%85%8b,
94,12/9/2020,2020,12,9,4,Wednesday,EW,Y-8 EW,1,Southwest ADIZ,,,,https://www.mnd.gov.tw/Publish.aspx?p=77691&title=%e5%9c%8b%e9%98%b2%e6%b6%88%e6%81%af&SelectStyle=%e5%8d%b3%e6%99%82%e8%bb%8d%e4%ba%8b%e5%8b%95%e6%85%8b,
95,12/9/2020,2020,12,9,4,Wednesday,RECCE,Y-8 RECCE,1,Southwest ADIZ,,,,https://www.mnd.gov.tw/Publish.aspx?p=77691&title=%e5%9c%8b%e9%98%b2%e6%b6%88%e6%81%af&SelectStyle=%e5%8d%b3%e6%99%82%e8%bb%8d%e4%ba%8b%e5%8b%95%e6%85%8b,
96,12/10/2020,2020,12,10,5,Thursday,EW,Y-8 EW,1,Southwest ADIZ,,,,https://www.mnd.gov.tw/Publish.aspx?p=77692&title=%e5%9c%8b%e9%98%b2%e6%b6%88%e6%81%af&SelectStyle=%e5%8d%b3%e6%99%82%e8%bb%8d%e4%ba%8b%e5%8b%95%e6%85%8b,
97,12/12/2020,2020,12,12,7,Saturday,ASW,Y-8 ASW,1,Southwest ADIZ,,,,https://www.mnd.gov.tw/Publish.aspx?p=77701&title=%e5%9c%8b%e9%98%b2%e6%b6%88%e6%81%af&SelectStyle=%e5%8d%b3%e6%99%82%e8%bb%8d%e4%ba%8b%e5%8b%95%e6%85%8b,
98,12/15/2020,2020,12,15,3,Tuesday,ASW,Y-8 ASW,1,Southwest ADIZ,,,,https://www.mnd.gov.tw/Publish.aspx?p=77710&title=%e5%9c%8b%e9%98%b2%e6%b6%88%e6%81%af&SelectStyle=%e5%8d%b3%e6%99%82%e8%bb%8d%e4%ba%8b%e5%8b%95%e6%85%8b,
99,12/15/2020,2020,12,15,3,Tuesday,RECCE,Y-8 RECCE,1,Southwest ADIZ,,,,https://www.mnd.gov.tw/Publish.aspx?p=77710&title=%e5%9c%8b%e9%98%b2%e6%b6%88%e6%81%af&SelectStyle=%e5%8d%b3%e6%99%82%e8%bb%8d%e4%ba%8b%e5%8b%95%e6%85%8b,
100,12/16/2020,2020,12,16,4,Wednesday,ASW,Y-8 ASW,1,Southwest ADIZ,,,,https://www.mnd.gov.tw/Publish.aspx?p=77714&title=%e5%9c%8b%e9%98%b2%e6%b6%88%e6%81%af&SelectStyle=%e5%8d%b3%e6%99%82%e8%bb%8d%e4%ba%8b%e5%8b%95%e6%85%8b,
101,12/16/2020,2020,12,16,4,Wednesday,ELINT,Y-8 ELINT,1,Southwest ADIZ,,,,https://www.mnd.gov.tw/Publish.aspx?p=77714&title=%e5%9c%8b%e9%98%b2%e6%b6%88%e6%81%af&SelectStyle=%e5%8d%b3%e6%99%82%e8%bb%8d%e4%ba%8b%e5%8b%95%e6%85%8b,
102,12/16/2020,2020,12,16,4,Wednesday,EW,Y-9 EW,1,Southwest ADIZ,,,,https://www.mnd.gov.tw/Publish.aspx?p=77714&title=%e5%9c%8b%e9%98%b2%e6%b6%88%e6%81%af&SelectStyle=%e5%8d%b3%e6%99%82%e8%bb%8d%e4%ba%8b%e5%8b%95%e6%85%8b,
103,12/16/2020,2020,12,16,4,Wednesday,RECCE,Y-8 RECCE,1,Southwest ADIZ,,,,https://www.mnd.gov.tw/Publish.aspx?p=77714&title=%e5%9c%8b%e9%98%b2%e6%b6%88%e6%81%af&SelectStyle=%e5%8d%b3%e6%99%82%e8%bb%8d%e4%ba%8b%e5%8b%95%e6%85%8b,
104,12/20/2020,2020,12,20,1,Sunday,EW,Y-8 EW,1,Southwest ADIZ,,,,https://www.mnd.gov.tw/Publish.aspx?p=77754&title=%e5%9c%8b%e9%98%b2%e6%b6%88%e6%81%af&SelectStyle=%e5%8d%b3%e6%99%82%e8%bb%8d%e4%ba%8b%e5%8b%95%e6%85%8b,
105,12/20/2020,2020,12,20,1,Sunday,ASW,Y-8 ASW,1,Southwest ADIZ,,,,https://www.mnd.gov.tw/Publish.aspx?p=77754&title=%e5%9c%8b%e9%98%b2%e6%b6%88%e6%81%af&SelectStyle=%e5%8d%b3%e6%99%82%e8%bb%8d%e4%ba%8b%e5%8b%95%e6%85%8b,
106,12/21/2020,2020,12,21,2,Monday,EW,Y-9 EW,1,Southwest ADIZ,,,,https://www.mnd.gov.tw/Publish.aspx?p=77760&title=%e5%9c%8b%e9%98%b2%e6%b6%88%e6%81%af&SelectStyle=%e5%8d%b3%e6%99%82%e8%bb%8d%e4%ba%8b%e5%8b%95%e6%85%8b,
107,12/21/2020,2020,12,21,2,Monday,RECCE,Y-8 RECCE,1,Southwest ADIZ,,,Southern tip of the median line,https://www.mnd.gov.tw/Publish.aspx?p=77760&title=%e5%9c%8b%e9%98%b2%e6%b6%88%e6%81%af&SelectStyle=%e5%8d%b3%e6%99%82%e8%bb%8d%e4%ba%8b%e5%8b%95%e6%85%8b,
108,12/22/2020,2020,12,22,3,Tuesday,ASW,Y-8 ASW,1,Southwest ADIZ,,,,https://www.mnd.gov.tw/Publish.aspx?p=77762&title=%e5%9c%8b%e9%98%b2%e6%b6%88%e6%81%af&SelectStyle=%e5%8d%b3%e6%99%82%e8%bb%8d%e4%ba%8b%e5%8b%95%e6%85%8b,
109,12/22/2020,2020,12,22,3,Tuesday,EW,Y-8 EW,1,Southwest ADIZ,,,,https://www.mnd.gov.tw/Publish.aspx?p=77762&title=%e5%9c%8b%e9%98%b2%e6%b6%88%e6%81%af&SelectStyle=%e5%8d%b3%e6%99%82%e8%bb%8d%e4%ba%8b%e5%8b%95%e6%85%8b,
110,12/24/2020,2020,12,24,5,Thursday,ASW,Y-8 ASW,1,Southwest ADIZ,,,,https://www.mnd.gov.tw/Publish.aspx?p=77776&title=%e5%9c%8b%e9%98%b2%e6%b6%88%e6%81%af&SelectStyle=%e5%8d%b3%e6%99%82%e8%bb%8d%e4%ba%8b%e5%8b%95%e6%85%8b,
111,12/24/2020,2020,12,24,5,Thursday,EW,Y-8 EW,1,Southwest ADIZ,,,,https://www.mnd.gov.tw/Publish.aspx?p=77776&title=%e5%9c%8b%e9%98%b2%e6%b6%88%e6%81%af&SelectStyle=%e5%8d%b3%e6%99%82%e8%bb%8d%e4%ba%8b%e5%8b%95%e6%85%8b,
112,12/25/2020,2020,12,25,6,Friday,ASW,Y-8 ASW,1,Southwest ADIZ,,,"Y-8 RECCE took a long, protracted flight around the south-eastern end",https://www.mnd.gov.tw/Publish.aspx?p=77790&title=%e5%9c%8b%e9%98%b2%e6%b6%88%e6%81%af&SelectStyle=%e5%8d%b3%e6%99%82%e8%bb%8d%e4%ba%8b%e5%8b%95%e6%85%8b,
113,12/25/2020,2020,12,25,6,Friday,RECCE,Y-8 RECCE,1,Southwest ADIZ,,,,https://www.mnd.gov.tw/Publish.aspx?p=77790&title=%e5%9c%8b%e9%98%b2%e6%b6%88%e6%81%af&SelectStyle=%e5%8d%b3%e6%99%82%e8%bb%8d%e4%ba%8b%e5%8b%95%e6%85%8b,
114,12/26/2020,2020,12,26,7,Saturday,ASW,Y-8 ASW,1,Southwest ADIZ,,,,https://www.mnd.gov.tw/Publish.aspx?p=77819&title=%e5%9c%8b%e9%98%b2%e6%b6%88%e6%81%af&SelectStyle=%e5%8d%b3%e6%99%82%e8%bb%8d%e4%ba%8b%e5%8b%95%e6%85%8b,
115,12/28/2020,2020,12,28,2,Monday,RECCE,Y-8 RECCE,1,Southwest ADIZ,,,,https://www.mnd.gov.tw/Publish.aspx?p=77826&title=%e5%9c%8b%e9%98%b2%e6%b6%88%e6%81%af&SelectStyle=%e5%8d%b3%e6%99%82%e8%bb%8d%e4%ba%8b%e5%8b%95%e6%85%8b,
116,12/29/2020,2020,12,29,3,Tuesday,ASW,Y-8 ASW,1,Southwest ADIZ,,,,https://www.mnd.gov.tw/Publish.aspx?p=77829&title=%e5%9c%8b%e9%98%b2%e6%b6%88%e6%81%af&SelectStyle=%e5%8d%b3%e6%99%82%e8%bb%8d%e4%ba%8b%e5%8b%95%e6%85%8b,
117,1/2/2021,2021,1,2,7,Saturday,RECCE,Y-8 RECCE,1,Southwest ADIZ,,,,https://www.mnd.gov.tw/Publish.aspx?p=77845&title=%e5%9c%8b%e9%98%b2%e6%b6%88%e6%81%af&SelectStyle=%e5%8d%b3%e6%99%82%e8%bb%8d%e4%ba%8b%e5%8b%95%e6%85%8b,
118,1/3/2021,2021,1,3,1,Sunday,ASW,Y-8 ASW,1,Southwest ADIZ,,,,https://www.mnd.gov.tw/Publish.aspx?p=77868&title=%e5%9c%8b%e9%98%b2%e6%b6%88%e6%81%af&SelectStyle=%e5%8d%b3%e6%99%82%e8%bb%8d%e4%ba%8b%e5%8b%95%e6%85%8b,
119,1/4/2021,2021,1,4,2,Monday,EW,Y-8 EW,1,Southwest ADIZ,,,,https://www.mnd.gov.tw/Publish.aspx?p=77871&title=%e5%9c%8b%e9%98%b2%e6%b6%88%e6%81%af&SelectStyle=%e5%8d%b3%e6%99%82%e8%bb%8d%e4%ba%8b%e5%8b%95%e6%85%8b,
120,1/4/2021,2021,1,4,2,Monday,ASW,Y-8 ASW,1,Southwest ADIZ,,,,https://www.mnd.gov.tw/Publish.aspx?p=77871&title=%e5%9c%8b%e9%98%b2%e6%b6%88%e6%81%af&SelectStyle=%e5%8d%b3%e6%99%82%e8%bb%8d%e4%ba%8b%e5%8b%95%e6%85%8b,
121,1/4/2021,2021,1,4,2,Monday,RECCE,Y-8 RECCE,1,Southwest ADIZ,,,,https://www.mnd.gov.tw/Publish.aspx?p=77871&title=%e5%9c%8b%e9%98%b2%e6%b6%88%e6%81%af&SelectStyle=%e5%8d%b3%e6%99%82%e8%bb%8d%e4%ba%8b%e5%8b%95%e6%85%8b,
122,1/4/2021,2021,1,4,2,Monday,EW,Y-9 EW,1,Southwest ADIZ,,,,https://www.mnd.gov.tw/Publish.aspx?p=77871&title=%e5%9c%8b%e9%98%b2%e6%b6%88%e6%81%af&SelectStyle=%e5%8d%b3%e6%99%82%e8%bb%8d%e4%ba%8b%e5%8b%95%e6%85%8b,
123,1/5/2021,2021,1,5,3,Tuesday,EW,Y-8 EW,1,Southwest ADIZ,,,,https://www.mnd.gov.tw/Publish.aspx?p=77878&title=%e5%9c%8b%e9%98%b2%e6%b6%88%e6%81%af&SelectStyle=%e5%8d%b3%e6%99%82%e8%bb%8d%e4%ba%8b%e5%8b%95%e6%85%8b,
124,1/6/2021,2021,1,6,4,Wednesday,ASW,Y-8 ASW,1,Southwest ADIZ,,,,https://www.mnd.gov.tw/Publish.aspx?p=77880&title=%E5%9C%8B%E9%98%B2%E6%B6%88%E6%81%AF&SelectStyle=%E5%8D%B3%E6%99%82%E8%BB%8D%E4%BA%8B%E5%8B%95%E6%85%8B,
125,1/6/2021,2021,1,6,4,Wednesday,EW,Y-8 EW,1,Southwest ADIZ,,,,https://www.mnd.gov.tw/Publish.aspx?p=77880&title=%E5%9C%8B%E9%98%B2%E6%B6%88%E6%81%AF&SelectStyle=%E5%8D%B3%E6%99%82%E8%BB%8D%E4%BA%8B%E5%8B%95%E6%85%8B,
126,1/7/2021,2021,1,7,5,Thursday,AEW&C,KJ-500,1,Southwest ADIZ,,,,https://www.mnd.gov.tw/Publish.aspx?p=77883&title=%e5%9c%8b%e9%98%b2%e6%b6%88%e6%81%af&SelectStyle=%e5%8d%b3%e6%99%82%e8%bb%8d%e4%ba%8b%e5%8b%95%e6%85%8b,
127,1/9/2021,2021,1,9,7,Saturday,ASW,Y-8 ASW,1,Southwest ADIZ,,,,https://www.mnd.gov.tw/Publish.aspx?p=77887&title=%e5%9c%8b%e9%98%b2%e6%b6%88%e6%81%af&SelectStyle=%e5%8d%b3%e6%99%82%e8%bb%8d%e4%ba%8b%e5%8b%95%e6%85%8b,
128,1/11/2021,2021,1,11,2,Monday,RECCE,Y-8 RECCE,1,Southwest ADIZ,,,,https://www.mnd.gov.tw/Publish.aspx?p=77889&title=%e5%9c%8b%e9%98%b2%e6%b6%88%e6%81%af&SelectStyle=%e5%8d%b3%e6%99%82%e8%bb%8d%e4%ba%8b%e5%8b%95%e6%85%8b,
129,1/12/2021,2021,1,12,3,Tuesday,ASW,Y-8 ASW,1,Southwest ADIZ,,,,https://www.mnd.gov.tw/Publish.aspx?p=77894&title=%e5%9c%8b%e9%98%b2%e6%b6%88%e6%81%af&SelectStyle=%e5%8d%b3%e6%99%82%e8%bb%8d%e4%ba%8b%e5%8b%95%e6%85%8b,
130,1/12/2021,2021,1,12,3,Tuesday,EW,Y-8 EW,1,Southwest ADIZ,,,,https://www.mnd.gov.tw/Publish.aspx?p=77894&title=%e5%9c%8b%e9%98%b2%e6%b6%88%e6%81%af&SelectStyle=%e5%8d%b3%e6%99%82%e8%bb%8d%e4%ba%8b%e5%8b%95%e6%85%8b,
131,1/12/2021,2021,1,12,3,Tuesday,RECCE,Y-8 RECCE,1,Southwest ADIZ,,,,https://www.mnd.gov.tw/Publish.aspx?p=77894&title=%e5%9c%8b%e9%98%b2%e6%b6%88%e6%81%af&SelectStyle=%e5%8d%b3%e6%99%82%e8%bb%8d%e4%ba%8b%e5%8b%95%e6%85%8b,
132,1/13/2021,2021,1,13,4,Wednesday,ASW,Y-8 ASW,1,Southwest ADIZ,,,,https://www.mnd.gov.tw/NewUpload/202101/0113%E4%B8%AD%E5%85%B1%E8%BB%8D%E6%A9%9F%E6%B4%BB%E5%8B%95%E5%A0%B1%E5%91%8A(%E4%B8%AD%E8%8B%B1%E6%96%87%E7%89%88)_482492.pdf,
133,1/14/2021,2021,1,14,5,Thursday,EW,Y-8 EW,1,Southwest ADIZ,,,,https://www.mnd.gov.tw/Publish.aspx?p=77908&title=%e5%9c%8b%e9%98%b2%e6%b6%88%e6%81%af&SelectStyle=%e5%8d%b3%e6%99%82%e8%bb%8d%e4%ba%8b%e5%8b%95%e6%85%8b,
134,1/14/2021,2021,1,14,5,Thursday,RECCE,Y-8 RECCE,1,Southwest ADIZ,,,,https://www.mnd.gov.tw/Publish.aspx?p=77908&title=%e5%9c%8b%e9%98%b2%e6%b6%88%e6%81%af&SelectStyle=%e5%8d%b3%e6%99%82%e8%bb%8d%e4%ba%8b%e5%8b%95%e6%85%8b,
135,1/15/2021,2021,1,15,6,Friday,ASW,Y-8 ASW,1,Southwest ADIZ,,,,https://www.mnd.gov.tw/Publish.aspx?p=77910&title=%e5%9c%8b%e9%98%b2%e6%b6%88%e6%81%af&SelectStyle=%e5%8d%b3%e6%99%82%e8%bb%8d%e4%ba%8b%e5%8b%95%e6%85%8b,
136,1/16/2021,2021,1,16,7,Saturday,ASW,Y-8 ASW,1,Southwest ADIZ,,,,https://www.mnd.gov.tw/Publish.aspx?p=77912&title=%e5%9c%8b%e9%98%b2%e6%b6%88%e6%81%af&SelectStyle=%e5%8d%b3%e6%99%82%e8%bb%8d%e4%ba%8b%e5%8b%95%e6%85%8b,
137,1/17/2021,2021,1,17,1,Sunday,EW,Y-8 EW,1,Southwest ADIZ,,,,https://www.mnd.gov.tw/Publish.aspx?p=77914&title=%e5%9c%8b%e9%98%b2%e6%b6%88%e6%81%af&SelectStyle=%e5%8d%b3%e6%99%82%e8%bb%8d%e4%ba%8b%e5%8b%95%e6%85%8b,
138,1/18/2021,2021,1,18,2,Monday,RECCE,Y-8 RECCE,1,Southwest ADIZ,,,,https://www.mnd.gov.tw/Publish.aspx?p=77917&title=%e5%9c%8b%e9%98%b2%e6%b6%88%e6%81%af&SelectStyle=%e5%8d%b3%e6%99%82%e8%bb%8d%e4%ba%8b%e5%8b%95%e6%85%8b,
139,1/18/2021,2021,1,18,2,Monday,ASW,Y-8 ASW,1,Southwest ADIZ,,,,https://www.mnd.gov.tw/Publish.aspx?p=77917&title=%e5%9c%8b%e9%98%b2%e6%b6%88%e6%81%af&SelectStyle=%e5%8d%b3%e6%99%82%e8%bb%8d%e4%ba%8b%e5%8b%95%e6%85%8b,
140,1/18/2021,2021,1,18,2,Monday,EW,Y-8 EW,1,Southwest ADIZ,,,,https://www.mnd.gov.tw/Publish.aspx?p=77917&title=%e5%9c%8b%e9%98%b2%e6%b6%88%e6%81%af&SelectStyle=%e5%8d%b3%e6%99%82%e8%bb%8d%e4%ba%8b%e5%8b%95%e6%85%8b,
141,1/19/2021,2021,1,19,3,Tuesday,ELINT,Y-8 ELINT,1,Southwest ADIZ,,,Came from south and barely touched S/W corner,https://www.mnd.gov.tw/Publish.aspx?p=77930&title=%e5%9c%8b%e9%98%b2%e6%b6%88%e6%81%af&SelectStyle=%e5%8d%b3%e6%99%82%e8%bb%8d%e4%ba%8b%e5%8b%95%e6%85%8b,
142,1/19/2021,2021,1,19,3,Tuesday,EW,Y-8 EW,1,Southwest ADIZ,,,,https://www.mnd.gov.tw/Publish.aspx?p=77930&title=%e5%9c%8b%e9%98%b2%e6%b6%88%e6%81%af&SelectStyle=%e5%8d%b3%e6%99%82%e8%bb%8d%e4%ba%8b%e5%8b%95%e6%85%8b,
143,1/20/2021,2021,1,20,4,Wednesday,RECCE,Y-8 RECCE,1,Southwest ADIZ,,,,https://www.mnd.gov.tw/Publish.aspx?p=77941&title=%e5%9c%8b%e9%98%b2%e6%b6%88%e6%81%af&SelectStyle=%e5%8d%b3%e6%99%82%e8%bb%8d%e4%ba%8b%e5%8b%95%e6%85%8b,
144,1/22/2021,2021,1,22,6,Friday,EW,Y-9 EW,1,Southwest ADIZ,,,"No return route, departed South",https://www.mnd.gov.tw/Publish.aspx?p=77952&title=%e5%9c%8b%e9%98%b2%e6%b6%88%e6%81%af&SelectStyle=%e5%8d%b3%e6%99%82%e8%bb%8d%e4%ba%8b%e5%8b%95%e6%85%8b,
145,1/23/2021,2021,1,23,7,Saturday,ASW,Y-8 ASW,1,Southwest ADIZ,,,,https://www.mnd.gov.tw/Publish.aspx?p=77954&title=%e5%9c%8b%e9%98%b2%e6%b6%88%e6%81%af&SelectStyle=%e5%8d%b3%e6%99%82%e8%bb%8d%e4%ba%8b%e5%8b%95%e6%85%8b,
146,1/23/2021,2021,1,23,7,Saturday,Bomber,H-6K,8,Southwest ADIZ,,,,https://www.mnd.gov.tw/Publish.aspx?p=77954&title=%e5%9c%8b%e9%98%b2%e6%b6%88%e6%81%af&SelectStyle=%e5%8d%b3%e6%99%82%e8%bb%8d%e4%ba%8b%e5%8b%95%e6%85%8b,
147,1/23/2021,2021,1,23,7,Saturday,Fighter,J-16,4,Southwest ADIZ,,,,https://www.mnd.gov.tw/Publish.aspx?p=77954&title=%e5%9c%8b%e9%98%b2%e6%b6%88%e6%81%af&SelectStyle=%e5%8d%b3%e6%99%82%e8%bb%8d%e4%ba%8b%e5%8b%95%e6%85%8b,
148,1/24/2021,2021,1,24,1,Sunday,ASW,Y-8 ASW,2,Southwest ADIZ,,,,https://www.mnd.gov.tw/Publish.aspx?p=77956&title=%e5%9c%8b%e9%98%b2%e6%b6%88%e6%81%af&SelectStyle=%e5%8d%b3%e6%99%82%e8%bb%8d%e4%ba%8b%e5%8b%95%e6%85%8b,
149,1/24/2021,2021,1,24,1,Sunday,Fighter,SU-30,2,Southwest ADIZ,,,,https://www.mnd.gov.tw/Publish.aspx?p=77956&title=%e5%9c%8b%e9%98%b2%e6%b6%88%e6%81%af&SelectStyle=%e5%8d%b3%e6%99%82%e8%bb%8d%e4%ba%8b%e5%8b%95%e6%85%8b,
150,1/24/2021,2021,1,24,1,Sunday,Fighter,J-16,4,Southwest ADIZ,,,,https://www.mnd.gov.tw/Publish.aspx?p=77956&title=%e5%9c%8b%e9%98%b2%e6%b6%88%e6%81%af&SelectStyle=%e5%8d%b3%e6%99%82%e8%bb%8d%e4%ba%8b%e5%8b%95%e6%85%8b,
151,1/24/2021,2021,1,24,1,Sunday,Fighter,J-10,6,Southwest ADIZ,,,,https://www.mnd.gov.tw/Publish.aspx?p=77956&title=%e5%9c%8b%e9%98%b2%e6%b6%88%e6%81%af&SelectStyle=%e5%8d%b3%e6%99%82%e8%bb%8d%e4%ba%8b%e5%8b%95%e6%85%8b,
152,1/24/2021,2021,1,24,1,Sunday,RECCE,Y-8 RECCE,1,Southwest ADIZ,,,,https://www.mnd.gov.tw/Publish.aspx?p=77956&title=%e5%9c%8b%e9%98%b2%e6%b6%88%e6%81%af&SelectStyle=%e5%8d%b3%e6%99%82%e8%bb%8d%e4%ba%8b%e5%8b%95%e6%85%8b,
153,1/25/2021,2021,1,25,2,Monday,ASW,Y-8 ASW,1,Southwest ADIZ,,,,https://www.mnd.gov.tw/Publish.aspx?p=77959&title=%e5%9c%8b%e9%98%b2%e6%b6%88%e6%81%af&SelectStyle=%e5%8d%b3%e6%99%82%e8%bb%8d%e4%ba%8b%e5%8b%95%e6%85%8b,
154,1/26/2021,2021,1,26,3,Tuesday,ASW,Y-8 ASW,1,Southwest ADIZ,,,Came from south and returned that direction,https://www.mnd.gov.tw/NewUpload/202101/0126%E4%B8%AD%E5%85%B1%E8%BB%8D%E6%A9%9F%E6%B4%BB%E5%8B%95%E5%A0%B1%E5%91%8A(%E4%B8%AD%E8%8B%B1%E6%96%87%E7%89%88)_371365.pdf,
155,1/26/2021,2021,1,26,3,Tuesday,EW,Y-8 EW,1,Southwest ADIZ,,,,https://www.mnd.gov.tw/NewUpload/202101/0126%E4%B8%AD%E5%85%B1%E8%BB%8D%E6%A9%9F%E6%B4%BB%E5%8B%95%E5%A0%B1%E5%91%8A(%E4%B8%AD%E8%8B%B1%E6%96%87%E7%89%88)_371365.pdf,
156,1/26/2021,2021,1,26,3,Tuesday,Fighter,J-10,2,Southwest ADIZ,,,,https://www.mnd.gov.tw/NewUpload/202101/0126%E4%B8%AD%E5%85%B1%E8%BB%8D%E6%A9%9F%E6%B4%BB%E5%8B%95%E5%A0%B1%E5%91%8A(%E4%B8%AD%E8%8B%B1%E6%96%87%E7%89%88)_371365.pdf,
157,1/27/2021,2021,1,27,4,Wednesday,ASW,Y-8 ASW,2,Southwest ADIZ,,,One Y-8 ASW came from south and returned that direction,https://www.mnd.gov.tw/Publish.aspx?p=78000&title=%e5%9c%8b%e9%98%b2%e6%b6%88%e6%81%af&SelectStyle=%e5%8d%b3%e6%99%82%e8%bb%8d%e4%ba%8b%e5%8b%95%e6%85%8b,
158,1/27/2021,2021,1,27,4,Wednesday,EW,Y-8 EW,1,Southwest ADIZ,,,,https://www.mnd.gov.tw/Publish.aspx?p=78000&title=%e5%9c%8b%e9%98%b2%e6%b6%88%e6%81%af&SelectStyle=%e5%8d%b3%e6%99%82%e8%bb%8d%e4%ba%8b%e5%8b%95%e6%85%8b,
159,1/27/2021,2021,1,27,4,Wednesday,RECCE,Y-8 RECCE,1,Southwest ADIZ,,,,https://www.mnd.gov.tw/Publish.aspx?p=78000&title=%e5%9c%8b%e9%98%b2%e6%b6%88%e6%81%af&SelectStyle=%e5%8d%b3%e6%99%82%e8%bb%8d%e4%ba%8b%e5%8b%95%e6%85%8b,
160,1/28/2021,2021,1,28,5,Thursday,AEW&C,KJ-500,1,Southwest ADIZ,,,"Two reports for day, 1st incursion",https://www.mnd.gov.tw/Publish.aspx?p=78012&title=%e5%9c%8b%e9%98%b2%e6%b6%88%e6%81%af&SelectStyle=%e5%8d%b3%e6%99%82%e8%bb%8d%e4%ba%8b%e5%8b%95%e6%85%8b,
161,1/28/2021,2021,1,28,5,Thursday,ELINT,Y-8 ELINT,1,Southwest ADIZ,,,"Two reports for day, 1st incursion",https://www.mnd.gov.tw/Publish.aspx?p=78012&title=%e5%9c%8b%e9%98%b2%e6%b6%88%e6%81%af&SelectStyle=%e5%8d%b3%e6%99%82%e8%bb%8d%e4%ba%8b%e5%8b%95%e6%85%8b,
162,1/28/2021,2021,1,28,5,Thursday,Fighter,J-10,2,Southwest ADIZ,,,"Two reports for day, 1st incursion",https://www.mnd.gov.tw/Publish.aspx?p=78012&title=%e5%9c%8b%e9%98%b2%e6%b6%88%e6%81%af&SelectStyle=%e5%8d%b3%e6%99%82%e8%bb%8d%e4%ba%8b%e5%8b%95%e6%85%8b,
163,1/28/2021,2021,1,28,5,Thursday,Fighter,J-10,2,Southwest ADIZ,,,"Two reports for day, 2nd incursion, three hours after previous incursion",https://www.mnd.gov.tw/Publish.aspx?p=78014&title=%e5%9c%8b%e9%98%b2%e6%b6%88%e6%81%af&SelectStyle=%e5%8d%b3%e6%99%82%e8%bb%8d%e4%ba%8b%e5%8b%95%e6%85%8b,
164,1/29/2021,2021,1,29,6,Friday,ASW,Y-8 ASW,1,Southwest ADIZ,,,,https://www.mnd.gov.tw/Publish.aspx?p=78028&title=%e5%9c%8b%e9%98%b2%e6%b6%88%e6%81%af&SelectStyle=%e5%8d%b3%e6%99%82%e8%bb%8d%e4%ba%8b%e5%8b%95%e6%85%8b,
165,1/29/2021,2021,1,29,6,Friday,RECCE,Y-8 RECCE,1,Southwest ADIZ,,,,https://www.mnd.gov.tw/Publish.aspx?p=78028&title=%e5%9c%8b%e9%98%b2%e6%b6%88%e6%81%af&SelectStyle=%e5%8d%b3%e6%99%82%e8%bb%8d%e4%ba%8b%e5%8b%95%e6%85%8b,
166,1/30/2021,2021,1,30,7,Saturday,ASW,Y-8 ASW,1,Southwest ADIZ,,,,https://www.mnd.gov.tw/Publish.aspx?p=78031&title=%e5%9c%8b%e9%98%b2%e6%b6%88%e6%81%af&SelectStyle=%e5%8d%b3%e6%99%82%e8%bb%8d%e4%ba%8b%e5%8b%95%e6%85%8b,
167,1/31/2021,2021,1,31,1,Sunday,RECCE,Y-8 RECCE,1,Southwest ADIZ,,,"Two reports for day, 1st incursion",https://www.mnd.gov.tw/Publish.aspx?p=78033&title=%e5%9c%8b%e9%98%b2%e6%b6%88%e6%81%af&SelectStyle=%e5%8d%b3%e6%99%82%e8%bb%8d%e4%ba%8b%e5%8b%95%e6%85%8b,
168,1/31/2021,2021,1,31,1,Sunday,Fighter,J-10,2,Southwest ADIZ,,,"Two reports for day, 1st incursion",https://www.mnd.gov.tw/Publish.aspx?p=78033&title=%e5%9c%8b%e9%98%b2%e6%b6%88%e6%81%af&SelectStyle=%e5%8d%b3%e6%99%82%e8%bb%8d%e4%ba%8b%e5%8b%95%e6%85%8b,
169,1/31/2021,2021,1,31,1,Sunday,Fighter,J-11,2,Southwest ADIZ,,,"Two reports for day, 1st incursion",https://www.mnd.gov.tw/Publish.aspx?p=78033&title=%e5%9c%8b%e9%98%b2%e6%b6%88%e6%81%af&SelectStyle=%e5%8d%b3%e6%99%82%e8%bb%8d%e4%ba%8b%e5%8b%95%e6%85%8b,
170,1/31/2021,2021,1,31,1,Sunday,Fighter,J-11,2,Southwest ADIZ,,Night,"Two reports for day, 2nd incursion, three hours after previous incursion",https://www.mnd.gov.tw/Publish.aspx?p=78035&title=%e5%9c%8b%e9%98%b2%e6%b6%88%e6%81%af&SelectStyle=%e5%8d%b3%e6%99%82%e8%bb%8d%e4%ba%8b%e5%8b%95%e6%85%8b,
171,2/1/2021,2021,2,1,2,Monday,ASW,Y-8 ASW,1,Southwest ADIZ,,,,https://www.mnd.gov.tw/Publish.aspx?p=78042&title=%e5%9c%8b%e9%98%b2%e6%b6%88%e6%81%af&SelectStyle=%e5%8d%b3%e6%99%82%e8%bb%8d%e4%ba%8b%e5%8b%95%e6%85%8b,
172,2/2/2021,2021,2,2,3,Tuesday,RECCE,Y-8 RECCE,1,Southwest ADIZ,,,,https://www.mnd.gov.tw/Publish.aspx?p=78046&title=%e5%9c%8b%e9%98%b2%e6%b6%88%e6%81%af&SelectStyle=%e5%8d%b3%e6%99%82%e8%bb%8d%e4%ba%8b%e5%8b%95%e6%85%8b,
173,2/4/2021,2021,2,4,5,Thursday,ELINT,Y-8 ELINT,1,Southwest ADIZ,,,,https://www.mnd.gov.tw/Publish.aspx?p=78057&title=%e5%9c%8b%e9%98%b2%e6%b6%88%e6%81%af&SelectStyle=%e5%8d%b3%e6%99%82%e8%bb%8d%e4%ba%8b%e5%8b%95%e6%85%8b,
174,2/4/2021,2021,2,4,5,Thursday,RECCE,Y-8 RECCE,1,Southwest ADIZ,,,,https://www.mnd.gov.tw/Publish.aspx?p=78057&title=%e5%9c%8b%e9%98%b2%e6%b6%88%e6%81%af&SelectStyle=%e5%8d%b3%e6%99%82%e8%bb%8d%e4%ba%8b%e5%8b%95%e6%85%8b,
175,2/5/2021,2021,2,5,6,Friday,ASW,Y-8 ASW,1,Southwest ADIZ,,,,https://www.mnd.gov.tw/Publish.aspx?p=78068&title=%e5%9c%8b%e9%98%b2%e6%b6%88%e6%81%af&SelectStyle=%e5%8d%b3%e6%99%82%e8%bb%8d%e4%ba%8b%e5%8b%95%e6%85%8b,
176,2/6/2021,2021,2,6,7,Saturday,RECCE,Y-8 RECCE,1,Southwest ADIZ,,,,https://www.mnd.gov.tw/Publish.aspx?p=78075&title=%e5%9c%8b%e9%98%b2%e6%b6%88%e6%81%af&SelectStyle=%e5%8d%b3%e6%99%82%e8%bb%8d%e4%ba%8b%e5%8b%95%e6%85%8b,
177,2/7/2021,2021,2,7,1,Sunday,ASW,Y-8 ASW,2,Southwest ADIZ,,,One came from south and left same direction,https://www.mnd.gov.tw/Publish.aspx?p=78079&title=%e5%9c%8b%e9%98%b2%e6%b6%88%e6%81%af&SelectStyle=%e5%8d%b3%e6%99%82%e8%bb%8d%e4%ba%8b%e5%8b%95%e6%85%8b,
178,2/8/2021,2021,2,8,2,Monday,Fighter,J-16,2,Southwest ADIZ,,,,https://www.mnd.gov.tw/Publish.aspx?p=78089&title=%e5%9c%8b%e9%98%b2%e6%b6%88%e6%81%af&SelectStyle=%e5%8d%b3%e6%99%82%e8%bb%8d%e4%ba%8b%e5%8b%95%e6%85%8b,
179,2/13/2021,2021,2,13,7,Saturday,ASW,Y-8 ASW,1,Southwest ADIZ,,,,https://www.mnd.gov.tw/Publish.aspx?p=78094&title=%e5%9c%8b%e9%98%b2%e6%b6%88%e6%81%af&SelectStyle=%e5%8d%b3%e6%99%82%e8%bb%8d%e4%ba%8b%e5%8b%95%e6%85%8b,
180,2/13/2021,2021,2,13,7,Saturday,RECCE,Y-8 RECCE,1,Southwest ADIZ,,,,https://www.mnd.gov.tw/Publish.aspx?p=78094&title=%e5%9c%8b%e9%98%b2%e6%b6%88%e6%81%af&SelectStyle=%e5%8d%b3%e6%99%82%e8%bb%8d%e4%ba%8b%e5%8b%95%e6%85%8b,
181,2/15/2021,2021,2,15,2,Monday,ASW,Y-8 ASW,1,Southwest ADIZ,,,,https://www.mnd.gov.tw/Publish.aspx?p=78096&title=%e5%9c%8b%e9%98%b2%e6%b6%88%e6%81%af&SelectStyle=%e5%8d%b3%e6%99%82%e8%bb%8d%e4%ba%8b%e5%8b%95%e6%85%8b,
182,2/16/2021,2021,2,16,3,Tuesday,ASW,Y-8 ASW,1,Southwest ADIZ,,,,https://www.mnd.gov.tw/Publish.aspx?p=78098&title=%e5%9c%8b%e9%98%b2%e6%b6%88%e6%81%af&SelectStyle=%e5%8d%b3%e6%99%82%e8%bb%8d%e4%ba%8b%e5%8b%95%e6%85%8b,
183,2/17/2021,2021,2,17,4,Wednesday,RECCE,Y-8 RECCE,2,Southwest ADIZ,,,,https://www.mnd.gov.tw/Publish.aspx?p=78108&title=%e5%9c%8b%e9%98%b2%e6%b6%88%e6%81%af&SelectStyle=%e5%8d%b3%e6%99%82%e8%bb%8d%e4%ba%8b%e5%8b%95%e6%85%8b,
184,2/18/2021,2021,2,18,5,Thursday,RECCE,Y-8 RECCE,1,Southwest ADIZ,,,,https://www.mnd.gov.tw/Publish.aspx?p=78155&title=%e5%9c%8b%e9%98%b2%e6%b6%88%e6%81%af&SelectStyle=%e5%8d%b3%e6%99%82%e8%bb%8d%e4%ba%8b%e5%8b%95%e6%85%8b,
185,2/19/2021,2021,2,19,6,Friday,Fighter,J-16,4,Southwest ADIZ,,,,https://www.mnd.gov.tw/Publish.aspx?p=78160&title=%e5%9c%8b%e9%98%b2%e6%b6%88%e6%81%af&SelectStyle=%e5%8d%b3%e6%99%82%e8%bb%8d%e4%ba%8b%e5%8b%95%e6%85%8b,
186,2/19/2021,2021,2,19,6,Friday,Attack,JH-7,4,Southwest ADIZ,,,,https://www.mnd.gov.tw/Publish.aspx?p=78160&title=%e5%9c%8b%e9%98%b2%e6%b6%88%e6%81%af&SelectStyle=%e5%8d%b3%e6%99%82%e8%bb%8d%e4%ba%8b%e5%8b%95%e6%85%8b,
187,2/19/2021,2021,2,19,6,Friday,EW,Y-9 EW,1,Southwest ADIZ,,,,https://www.mnd.gov.tw/Publish.aspx?p=78160&title=%e5%9c%8b%e9%98%b2%e6%b6%88%e6%81%af&SelectStyle=%e5%8d%b3%e6%99%82%e8%bb%8d%e4%ba%8b%e5%8b%95%e6%85%8b,
188,2/20/2021,2021,2,20,7,Saturday,Fighter,J-10,2,Southwest ADIZ,,,,https://www.mnd.gov.tw/Publish.aspx?p=78181&title=%e5%9c%8b%e9%98%b2%e6%b6%88%e6%81%af&SelectStyle=%e5%8d%b3%e6%99%82%e8%bb%8d%e4%ba%8b%e5%8b%95%e6%85%8b,
189,2/20/2021,2021,2,20,7,Saturday,Fighter,J-16,2,Southwest ADIZ,,,,https://www.mnd.gov.tw/Publish.aspx?p=78181&title=%e5%9c%8b%e9%98%b2%e6%b6%88%e6%81%af&SelectStyle=%e5%8d%b3%e6%99%82%e8%bb%8d%e4%ba%8b%e5%8b%95%e6%85%8b,
190,2/20/2021,2021,2,20,7,Saturday,Attack,JH-7,4,Southwest ADIZ,,,,https://www.mnd.gov.tw/Publish.aspx?p=78181&title=%e5%9c%8b%e9%98%b2%e6%b6%88%e6%81%af&SelectStyle=%e5%8d%b3%e6%99%82%e8%bb%8d%e4%ba%8b%e5%8b%95%e6%85%8b,
191,2/20/2021,2021,2,20,7,Saturday,Bomber,H-6K,2,Southwest ADIZ,,,,https://www.mnd.gov.tw/Publish.aspx?p=78181&title=%e5%9c%8b%e9%98%b2%e6%b6%88%e6%81%af&SelectStyle=%e5%8d%b3%e6%99%82%e8%bb%8d%e4%ba%8b%e5%8b%95%e6%85%8b,
192,2/20/2021,2021,2,20,7,Saturday,ASW,Y-8 ASW,1,Southwest ADIZ,,,,https://www.mnd.gov.tw/Publish.aspx?p=78181&title=%e5%9c%8b%e9%98%b2%e6%b6%88%e6%81%af&SelectStyle=%e5%8d%b3%e6%99%82%e8%bb%8d%e4%ba%8b%e5%8b%95%e6%85%8b,
193,2/22/2021,2021,2,22,2,Monday,ASW,Y-8 ASW,1,Southwest ADIZ,,,,https://www.mnd.gov.tw/Publish.aspx?p=78189&title=%e5%9c%8b%e9%98%b2%e6%b6%88%e6%81%af&SelectStyle=%e5%8d%b3%e6%99%82%e8%bb%8d%e4%ba%8b%e5%8b%95%e6%85%8b,
194,2/23/2021,2021,2,23,3,Tuesday,ASW,Y-8 ASW,1,Southwest ADIZ,,,,https://www.mnd.gov.tw/Publish.aspx?p=78192&title=%e5%9c%8b%e9%98%b2%e6%b6%88%e6%81%af&SelectStyle=%e5%8d%b3%e6%99%82%e8%bb%8d%e4%ba%8b%e5%8b%95%e6%85%8b,
195,2/28/2021,2021,2,28,1,Sunday,ASW,Y-8 ASW,1,Southwest ADIZ,,,,https://www.mnd.gov.tw/Publish.aspx?p=78227&title=%e5%9c%8b%e9%98%b2%e6%b6%88%e6%81%af&SelectStyle=%e5%8d%b3%e6%99%82%e8%bb%8d%e4%ba%8b%e5%8b%95%e6%85%8b,
196,3/1/2021,2021,3,1,2,Monday,ASW,Y-8 ASW,1,Southwest ADIZ,,,,https://www.mnd.gov.tw/Publish.aspx?p=78229&title=%e5%9c%8b%e9%98%b2%e6%b6%88%e6%81%af&SelectStyle=%e5%8d%b3%e6%99%82%e8%bb%8d%e4%ba%8b%e5%8b%95%e6%85%8b,
197,3/2/2021,2021,3,2,3,Tuesday,RECCE,Y-8 RECCE,1,Southwest ADIZ,,,,https://www.mnd.gov.tw/Publish.aspx?p=78232&title=%e5%9c%8b%e9%98%b2%e6%b6%88%e6%81%af&SelectStyle=%e5%8d%b3%e6%99%82%e8%bb%8d%e4%ba%8b%e5%8b%95%e6%85%8b,
198,3/3/2021,2021,3,3,4,Wednesday,ASW,Y-8 ASW,1,Southwest ADIZ,,,,https://www.mnd.gov.tw/Publish.aspx?p=78241&title=%e5%9c%8b%e9%98%b2%e6%b6%88%e6%81%af&SelectStyle=%e5%8d%b3%e6%99%82%e8%bb%8d%e4%ba%8b%e5%8b%95%e6%85%8b,
199,3/3/2021,2021,3,3,4,Wednesday,RECCE,Y-8 RECCE,1,Southwest ADIZ,,,,https://www.mnd.gov.tw/Publish.aspx?p=78241&title=%e5%9c%8b%e9%98%b2%e6%b6%88%e6%81%af&SelectStyle=%e5%8d%b3%e6%99%82%e8%bb%8d%e4%ba%8b%e5%8b%95%e6%85%8b,
200,3/8/2021,2021,3,8,2,Monday,RECCE,Y-8 RECCE,1,Southwest ADIZ,,,,https://www.mnd.gov.tw/Publish.aspx?p=78264&title=%e5%9c%8b%e9%98%b2%e6%b6%88%e6%81%af&SelectStyle=%e5%8d%b3%e6%99%82%e8%bb%8d%e4%ba%8b%e5%8b%95%e6%85%8b,
201,3/8/2021,2021,3,8,2,Monday,ASW,Y-8 ASW,1,Southwest ADIZ,,,,https://www.mnd.gov.tw/Publish.aspx?p=78264&title=%e5%9c%8b%e9%98%b2%e6%b6%88%e6%81%af&SelectStyle=%e5%8d%b3%e6%99%82%e8%bb%8d%e4%ba%8b%e5%8b%95%e6%85%8b,
202,3/10/2021,2021,3,10,4,Wednesday,ASW,Y-8 ASW,1,Southwest ADIZ,,,,https://www.mnd.gov.tw/Publish.aspx?p=78283&title=%e5%9c%8b%e9%98%b2%e6%b6%88%e6%81%af&SelectStyle=%e5%8d%b3%e6%99%82%e8%bb%8d%e4%ba%8b%e5%8b%95%e6%85%8b,
203,3/11/2021,2021,3,11,5,Thursday,ASW,Y-8 ASW,1,Southwest ADIZ,,,,https://www.mnd.gov.tw/Publish.aspx?p=78289&title=%e5%9c%8b%e9%98%b2%e6%b6%88%e6%81%af&SelectStyle=%e5%8d%b3%e6%99%82%e8%bb%8d%e4%ba%8b%e5%8b%95%e6%85%8b,
204,3/12/2021,2021,3,12,6,Friday,RECCE,Y-8 RECCE,1,Southwest ADIZ,,,,https://www.mnd.gov.tw/Publish.aspx?p=78293&title=%e5%9c%8b%e9%98%b2%e6%b6%88%e6%81%af&SelectStyle=%e5%8d%b3%e6%99%82%e8%bb%8d%e4%ba%8b%e5%8b%95%e6%85%8b,
205,3/14/2021,2021,3,14,1,Sunday,ASW,Y-8 ASW,1,Southwest ADIZ,,,,https://www.mnd.gov.tw/Publish.aspx?p=78298&title=%e5%9c%8b%e9%98%b2%e6%b6%88%e6%81%af&SelectStyle=%e5%8d%b3%e6%99%82%e8%bb%8d%e4%ba%8b%e5%8b%95%e6%85%8b,
206,3/15/2021,2021,3,15,2,Monday,RECCE,Y-8 RECCE,1,Southwest ADIZ,,,,https://www.mnd.gov.tw/Publish.aspx?p=78306&title=%e5%9c%8b%e9%98%b2%e6%b6%88%e6%81%af&SelectStyle=%e5%8d%b3%e6%99%82%e8%bb%8d%e4%ba%8b%e5%8b%95%e6%85%8b,
207,3/15/2021,2021,3,15,2,Monday,ASW,Y-8 ASW,1,Southwest ADIZ,,,,https://www.mnd.gov.tw/Publish.aspx?p=78306&title=%e5%9c%8b%e9%98%b2%e6%b6%88%e6%81%af&SelectStyle=%e5%8d%b3%e6%99%82%e8%bb%8d%e4%ba%8b%e5%8b%95%e6%85%8b,
208,3/17/2021,2021,3,17,4,Wednesday,ASW,Y-8 ASW,1,Southwest ADIZ,,,,https://www.mnd.gov.tw/Publish.aspx?p=78314&title=%e5%9c%8b%e9%98%b2%e6%b6%88%e6%81%af&SelectStyle=%e5%8d%b3%e6%99%82%e8%bb%8d%e4%ba%8b%e5%8b%95%e6%85%8b,
209,3/20/2021,2021,3,20,7,Saturday,ASW,Y-8 ASW,1,Southwest ADIZ,,,,https://www.mnd.gov.tw/Publish.aspx?p=78332&title=%e5%9c%8b%e9%98%b2%e6%b6%88%e6%81%af&SelectStyle=%e5%8d%b3%e6%99%82%e8%bb%8d%e4%ba%8b%e5%8b%95%e6%85%8b,
210,3/22/2021,2021,3,22,2,Monday,Fighter,J-10,2,Southwest ADIZ,,,,https://www.mnd.gov.tw/Publish.aspx?p=78341&title=%e5%9c%8b%e9%98%b2%e6%b6%88%e6%81%af&SelectStyle=%e5%8d%b3%e6%99%82%e8%bb%8d%e4%ba%8b%e5%8b%95%e6%85%8b,
211,3/24/2021,2021,3,24,4,Wednesday,Fighter,J-10,2,Southwest ADIZ,,,,https://www.mnd.gov.tw/Publish.aspx?p=78362&title=%e5%9c%8b%e9%98%b2%e6%b6%88%e6%81%af&SelectStyle=%e5%8d%b3%e6%99%82%e8%bb%8d%e4%ba%8b%e5%8b%95%e6%85%8b,
212,3/24/2021,2021,3,24,4,Wednesday,ASW,Y-8 ASW,1,Southwest ADIZ,,,,https://www.mnd.gov.tw/Publish.aspx?p=78362&title=%e5%9c%8b%e9%98%b2%e6%b6%88%e6%81%af&SelectStyle=%e5%8d%b3%e6%99%82%e8%bb%8d%e4%ba%8b%e5%8b%95%e6%85%8b,
213,3/25/2021,2021,3,25,5,Thursday,Fighter,J-10,2,Southwest ADIZ,,,AIT-TECRO Coast Guard Working Group MOU established https://www.ait.org.tw/ait-tecro-mou-to-establish-coast-guard-working-group/ ,https://www.mnd.gov.tw/Publish.aspx?p=78367&title=%e5%9c%8b%e9%98%b2%e6%b6%88%e6%81%af&SelectStyle=%e5%8d%b3%e6%99%82%e8%bb%8d%e4%ba%8b%e5%8b%95%e6%85%8b,
214,3/25/2021,2021,3,25,5,Thursday,ASW,Y-8 ASW,1,Southwest ADIZ,,,Xi's Fujian visit also notable: http://www.xinhuanet.com/english/2021-03/25/c_139835571.htm - https://www.scmp.com/news/china/politics/article/3127017/xi-jinping-points-chinas-cultural-past-shape-countrys-future - https://tv.cctv.com/2021/03/25/VIDEDb3dsHAXDboztAWZJ14y210325.shtml?spm=C31267.PFsKSaKh6QQC.S71105.19 ,https://www.mnd.gov.tw/Publish.aspx?p=78367&title=%e5%9c%8b%e9%98%b2%e6%b6%88%e6%81%af&SelectStyle=%e5%8d%b3%e6%99%82%e8%bb%8d%e4%ba%8b%e5%8b%95%e6%85%8b,
215,3/26/2021,2021,3,26,6,Friday,ASW,Y-8 ASW,2,Southwest ADIZ,,,One sortie circled around back to Southeast corner,https://www.mnd.gov.tw/Publish.aspx?p=78370&title=%e5%9c%8b%e9%98%b2%e6%b6%88%e6%81%af&SelectStyle=%e5%8d%b3%e6%99%82%e8%bb%8d%e4%ba%8b%e5%8b%95%e6%85%8b,
216,3/26/2021,2021,3,26,6,Friday,AEW&C,KJ-500,1,Southwest ADIZ,,,,https://www.mnd.gov.tw/Publish.aspx?p=78370&title=%e5%9c%8b%e9%98%b2%e6%b6%88%e6%81%af&SelectStyle=%e5%8d%b3%e6%99%82%e8%bb%8d%e4%ba%8b%e5%8b%95%e6%85%8b,
217,3/26/2021,2021,3,26,6,Friday,Bomber,H-6K,4,Southwest ADIZ,,, Two sorties circled around back to Southeast corner,https://www.mnd.gov.tw/Publish.aspx?p=78370&title=%e5%9c%8b%e9%98%b2%e6%b6%88%e6%81%af&SelectStyle=%e5%8d%b3%e6%99%82%e8%bb%8d%e4%ba%8b%e5%8b%95%e6%85%8b,
218,3/26/2021,2021,3,26,6,Friday,Fighter,J-16,10,Southwest ADIZ,,,,https://www.mnd.gov.tw/Publish.aspx?p=78370&title=%e5%9c%8b%e9%98%b2%e6%b6%88%e6%81%af&SelectStyle=%e5%8d%b3%e6%99%82%e8%bb%8d%e4%ba%8b%e5%8b%95%e6%85%8b,
219,3/26/2021,2021,3,26,6,Friday,Fighter,J-10,2,Southwest ADIZ,,,,https://www.mnd.gov.tw/Publish.aspx?p=78370&title=%e5%9c%8b%e9%98%b2%e6%b6%88%e6%81%af&SelectStyle=%e5%8d%b3%e6%99%82%e8%bb%8d%e4%ba%8b%e5%8b%95%e6%85%8b,
220,3/26/2021,2021,3,26,6,Friday,RECCE,Y-8 RECCE,1,Southwest ADIZ,,,,https://www.mnd.gov.tw/Publish.aspx?p=78370&title=%e5%9c%8b%e9%98%b2%e6%b6%88%e6%81%af&SelectStyle=%e5%8d%b3%e6%99%82%e8%bb%8d%e4%ba%8b%e5%8b%95%e6%85%8b,
221,3/27/2021,2021,3,27,7,Saturday,Fighter,J-10,1,Southwest ADIZ,,,,https://www.mnd.gov.tw/Publish.aspx?p=78372&title=%e5%9c%8b%e9%98%b2%e6%b6%88%e6%81%af&SelectStyle=%e5%8d%b3%e6%99%82%e8%bb%8d%e4%ba%8b%e5%8b%95%e6%85%8b,
222,3/29/2021,2021,3,29,2,Monday,AEW&C,KJ-500,1,Southwest ADIZ,,,,https://www.mnd.gov.tw/Publish.aspx?p=78381&title=%e5%9c%8b%e9%98%b2%e6%b6%88%e6%81%af&SelectStyle=%e5%8d%b3%e6%99%82%e8%bb%8d%e4%ba%8b%e5%8b%95%e6%85%8b,
223,3/29/2021,2021,3,29,2,Monday,ASW,Y-8 ASW,1,Southwest ADIZ,,,Circled around back to Southeast corner,https://www.mnd.gov.tw/Publish.aspx?p=78381&title=%e5%9c%8b%e9%98%b2%e6%b6%88%e6%81%af&SelectStyle=%e5%8d%b3%e6%99%82%e8%bb%8d%e4%ba%8b%e5%8b%95%e6%85%8b,
224,3/29/2021,2021,3,29,2,Monday,Fighter,J-16,4,Southwest ADIZ,,,,https://www.mnd.gov.tw/Publish.aspx?p=78381&title=%e5%9c%8b%e9%98%b2%e6%b6%88%e6%81%af&SelectStyle=%e5%8d%b3%e6%99%82%e8%bb%8d%e4%ba%8b%e5%8b%95%e6%85%8b,
225,3/29/2021,2021,3,29,2,Monday,Fighter,J-10,4,Southwest ADIZ,,,,https://www.mnd.gov.tw/Publish.aspx?p=78381&title=%e5%9c%8b%e9%98%b2%e6%b6%88%e6%81%af&SelectStyle=%e5%8d%b3%e6%99%82%e8%bb%8d%e4%ba%8b%e5%8b%95%e6%85%8b,
226,3/30/2021,2021,3,30,3,Tuesday,ASW,Y-8 ASW,1,Southwest ADIZ,,,,https://www.mnd.gov.tw/Publish.aspx?SelectStyle=%E5%8D%B3%E6%99%82%E8%BB%8D%E4%BA%8B%E5%8B%95%E6%85%8B&p=78384&title=%E5%9C%8B%E9%98%B2%E6%B6%88%E6%81%AF,
227,4/3/2021,2021,4,3,7,Saturday,ASW,Y-8 ASW,1,Southwest ADIZ,,,,https://www.mnd.gov.tw/Publish.aspx?p=78411&title=%e5%9c%8b%e9%98%b2%e6%b6%88%e6%81%af&SelectStyle=%e5%8d%b3%e6%99%82%e8%bb%8d%e4%ba%8b%e5%8b%95%e6%85%8b,
228,4/4/2021,2021,4,4,1,Sunday,RECCE,Y-8 RECCE,1,Southwest ADIZ,,,,https://www.mnd.gov.tw/Publish.aspx?p=78413&title=%e5%9c%8b%e9%98%b2%e6%b6%88%e6%81%af&SelectStyle=%e5%8d%b3%e6%99%82%e8%bb%8d%e4%ba%8b%e5%8b%95%e6%85%8b,
229,4/5/2021,2021,4,5,2,Monday,ASW,Y-8 ASW,1,Southwest ADIZ,,,Circled around back to Southeast corner,https://www.mnd.gov.tw/Publish.aspx?p=78416&title=%e5%9c%8b%e9%98%b2%e6%b6%88%e6%81%af&SelectStyle=%e5%8d%b3%e6%99%82%e8%bb%8d%e4%ba%8b%e5%8b%95%e6%85%8b,
230,4/5/2021,2021,4,5,2,Monday,AEW&C,KJ-500,1,Southwest ADIZ,,,,https://www.mnd.gov.tw/Publish.aspx?p=78416&title=%e5%9c%8b%e9%98%b2%e6%b6%88%e6%81%af&SelectStyle=%e5%8d%b3%e6%99%82%e8%bb%8d%e4%ba%8b%e5%8b%95%e6%85%8b,
231,4/5/2021,2021,4,5,2,Monday,Fighter,J-16,4,Southwest ADIZ,,,,https://www.mnd.gov.tw/Publish.aspx?p=78416&title=%e5%9c%8b%e9%98%b2%e6%b6%88%e6%81%af&SelectStyle=%e5%8d%b3%e6%99%82%e8%bb%8d%e4%ba%8b%e5%8b%95%e6%85%8b,
232,4/5/2021,2021,4,5,2,Monday,Fighter,J-10,4,Southwest ADIZ,,,,https://www.mnd.gov.tw/Publish.aspx?p=78416&title=%e5%9c%8b%e9%98%b2%e6%b6%88%e6%81%af&SelectStyle=%e5%8d%b3%e6%99%82%e8%bb%8d%e4%ba%8b%e5%8b%95%e6%85%8b,
233,4/6/2021,2021,4,6,3,Tuesday,Fighter,J-16,2,Southwest ADIZ,,,,https://www.mnd.gov.tw/Publish.aspx?p=78418&title=%e5%9c%8b%e9%98%b2%e6%b6%88%e6%81%af&SelectStyle=%e5%8d%b3%e6%99%82%e8%bb%8d%e4%ba%8b%e5%8b%95%e6%85%8b,
234,4/6/2021,2021,4,6,3,Tuesday,AEW&C,KJ-500,1,Southwest ADIZ,,,,https://www.mnd.gov.tw/Publish.aspx?p=78418&title=%e5%9c%8b%e9%98%b2%e6%b6%88%e6%81%af&SelectStyle=%e5%8d%b3%e6%99%82%e8%bb%8d%e4%ba%8b%e5%8b%95%e6%85%8b,
235,4/6/2021,2021,4,6,3,Tuesday,RECCE,Y-8 RECCE,1,Southwest ADIZ,,,,https://www.mnd.gov.tw/Publish.aspx?p=78418&title=%e5%9c%8b%e9%98%b2%e6%b6%88%e6%81%af&SelectStyle=%e5%8d%b3%e6%99%82%e8%bb%8d%e4%ba%8b%e5%8b%95%e6%85%8b,
236,4/7/2021,2021,4,7,4,Wednesday,Fighter,J-10,8,Southwest ADIZ,,,,https://www.mnd.gov.tw/Publish.aspx?p=78432&title=%e5%9c%8b%e9%98%b2%e6%b6%88%e6%81%af&SelectStyle=%e5%8d%b3%e6%99%82%e8%bb%8d%e4%ba%8b%e5%8b%95%e6%85%8b,
237,4/7/2021,2021,4,7,4,Wednesday,Fighter,J-16,4,Southwest ADIZ,,,,https://www.mnd.gov.tw/Publish.aspx?p=78432&title=%e5%9c%8b%e9%98%b2%e6%b6%88%e6%81%af&SelectStyle=%e5%8d%b3%e6%99%82%e8%bb%8d%e4%ba%8b%e5%8b%95%e6%85%8b,
238,4/7/2021,2021,4,7,4,Wednesday,ASW,Y-8 ASW,1,Southwest ADIZ,,,Circled around back to Southeast corner,https://www.mnd.gov.tw/Publish.aspx?p=78432&title=%e5%9c%8b%e9%98%b2%e6%b6%88%e6%81%af&SelectStyle=%e5%8d%b3%e6%99%82%e8%bb%8d%e4%ba%8b%e5%8b%95%e6%85%8b,
239,4/7/2021,2021,4,7,4,Wednesday,AEW&C,KJ-500,2,Southwest ADIZ,,,,https://www.mnd.gov.tw/Publish.aspx?p=78432&title=%e5%9c%8b%e9%98%b2%e6%b6%88%e6%81%af&SelectStyle=%e5%8d%b3%e6%99%82%e8%bb%8d%e4%ba%8b%e5%8b%95%e6%85%8b,
240,4/8/2021,2021,4,8,5,Thursday,ASW,Y-8 ASW,2,Southwest ADIZ,,,one from south,https://www.mnd.gov.tw/Publish.aspx?p=78444&title=%e5%9c%8b%e9%98%b2%e6%b6%88%e6%81%af&SelectStyle=%e5%8d%b3%e6%99%82%e8%bb%8d%e4%ba%8b%e5%8b%95%e6%85%8b,
241,4/9/2021,2021,4,9,6,Friday,Fighter,J-10,4,Southwest ADIZ,,,https://www.state.gov/new-guidelines-for-u-s-government-interactions-with-taiwan-counterparts/ ,https://www.mnd.gov.tw/Publish.aspx?p=78450&title=%e5%9c%8b%e9%98%b2%e6%b6%88%e6%81%af&SelectStyle=%e5%8d%b3%e6%99%82%e8%bb%8d%e4%ba%8b%e5%8b%95%e6%85%8b,
242,4/9/2021,2021,4,9,6,Friday,Fighter,J-16,4,Southwest ADIZ,,,,https://www.mnd.gov.tw/Publish.aspx?p=78450&title=%e5%9c%8b%e9%98%b2%e6%b6%88%e6%81%af&SelectStyle=%e5%8d%b3%e6%99%82%e8%bb%8d%e4%ba%8b%e5%8b%95%e6%85%8b,
243,4/9/2021,2021,4,9,6,Friday,EW,Y-8 EW,1,Southwest ADIZ,,,,https://www.mnd.gov.tw/Publish.aspx?p=78450&title=%e5%9c%8b%e9%98%b2%e6%b6%88%e6%81%af&SelectStyle=%e5%8d%b3%e6%99%82%e8%bb%8d%e4%ba%8b%e5%8b%95%e6%85%8b,
244,4/9/2021,2021,4,9,6,Friday,ASW,Y-8 ASW,1,Southwest ADIZ,,,Came from East,https://www.mnd.gov.tw/Publish.aspx?p=78450&title=%e5%9c%8b%e9%98%b2%e6%b6%88%e6%81%af&SelectStyle=%e5%8d%b3%e6%99%82%e8%bb%8d%e4%ba%8b%e5%8b%95%e6%85%8b,
245,4/9/2021,2021,4,9,6,Friday,AEW&C,KJ-500,1,Southwest ADIZ,,,,https://www.mnd.gov.tw/Publish.aspx?p=78450&title=%e5%9c%8b%e9%98%b2%e6%b6%88%e6%81%af&SelectStyle=%e5%8d%b3%e6%99%82%e8%bb%8d%e4%ba%8b%e5%8b%95%e6%85%8b,
246,4/10/2021,2021,4,10,7,Saturday,EW,Y-8 EW,1,Southwest ADIZ,,,,https://www.mnd.gov.tw/Publish.aspx?p=78453&title=%e5%9c%8b%e9%98%b2%e6%b6%88%e6%81%af&SelectStyle=%e5%8d%b3%e6%99%82%e8%bb%8d%e4%ba%8b%e5%8b%95%e6%85%8b,
247,4/10/2021,2021,4,10,7,Saturday,RECCE,Y-8 RECCE,1,Southwest ADIZ,,,,https://www.mnd.gov.tw/Publish.aspx?p=78453&title=%e5%9c%8b%e9%98%b2%e6%b6%88%e6%81%af&SelectStyle=%e5%8d%b3%e6%99%82%e8%bb%8d%e4%ba%8b%e5%8b%95%e6%85%8b,
248,4/10/2021,2021,4,10,7,Saturday,AEW&C,KJ-500,2,Southwest ADIZ,,,,https://www.mnd.gov.tw/Publish.aspx?p=78453&title=%e5%9c%8b%e9%98%b2%e6%b6%88%e6%81%af&SelectStyle=%e5%8d%b3%e6%99%82%e8%bb%8d%e4%ba%8b%e5%8b%95%e6%85%8b,
249,4/11/2021,2021,4,11,1,Sunday,EW,Y-8 EW,1,Southwest ADIZ,,,"Sec State Blinken: All I can tell you is we have a serious commitment to Taiwan being able to defend itself. We have a serious commitment to peace and security in the Western Pacific. We stand behind those commitments. And in that context, it would be a serious mistake for anyone to try to change that status quo by force. https://www.reuters.com/article/us-usa-taiwan-idINKBN2BY0GO ",https://www.mnd.gov.tw/Publish.aspx?p=78455&title=%e5%9c%8b%e9%98%b2%e6%b6%88%e6%81%af&SelectStyle=%e5%8d%b3%e6%99%82%e8%bb%8d%e4%ba%8b%e5%8b%95%e6%85%8b,
250,4/12/2021,2021,4,12,2,Monday,ASW,Y-8 ASW,2,Southwest ADIZ,,,,https://www.mnd.gov.tw/Publish.aspx?p=78460&title=%e5%9c%8b%e9%98%b2%e6%b6%88%e6%81%af&SelectStyle=%e5%8d%b3%e6%99%82%e8%bb%8d%e4%ba%8b%e5%8b%95%e6%85%8b,
251,4/12/2021,2021,4,12,2,Monday,AEW&C,KJ-500,1,Southwest ADIZ,,,,https://www.mnd.gov.tw/Publish.aspx?p=78460&title=%e5%9c%8b%e9%98%b2%e6%b6%88%e6%81%af&SelectStyle=%e5%8d%b3%e6%99%82%e8%bb%8d%e4%ba%8b%e5%8b%95%e6%85%8b,
252,4/12/2021,2021,4,12,2,Monday,Fighter,J-10,4,Southwest ADIZ,,,,https://www.mnd.gov.tw/Publish.aspx?p=78460&title=%e5%9c%8b%e9%98%b2%e6%b6%88%e6%81%af&SelectStyle=%e5%8d%b3%e6%99%82%e8%bb%8d%e4%ba%8b%e5%8b%95%e6%85%8b,
253,4/12/2021,2021,4,12,2,Monday,Fighter,J-16,14,Southwest ADIZ,,,,https://www.mnd.gov.tw/Publish.aspx?p=78460&title=%e5%9c%8b%e9%98%b2%e6%b6%88%e6%81%af&SelectStyle=%e5%8d%b3%e6%99%82%e8%bb%8d%e4%ba%8b%e5%8b%95%e6%85%8b,
254,4/12/2021,2021,4,12,2,Monday,Bomber,H-6K,4,Southwest ADIZ,,,,https://www.mnd.gov.tw/Publish.aspx?p=78460&title=%e5%9c%8b%e9%98%b2%e6%b6%88%e6%81%af&SelectStyle=%e5%8d%b3%e6%99%82%e8%bb%8d%e4%ba%8b%e5%8b%95%e6%85%8b,
255,4/13/2021,2021,4,13,3,Tuesday,ASW,Y-8 ASW,1,Southwest ADIZ,,,,https://www.mnd.gov.tw/Publish.aspx?p=78465&title=%e5%9c%8b%e9%98%b2%e6%b6%88%e6%81%af&SelectStyle=%e5%8d%b3%e6%99%82%e8%bb%8d%e4%ba%8b%e5%8b%95%e6%85%8b,
256,4/13/2021,2021,4,13,3,Tuesday,Fighter,J-16,4,Southwest ADIZ,,,,https://www.mnd.gov.tw/Publish.aspx?p=78465&title=%e5%9c%8b%e9%98%b2%e6%b6%88%e6%81%af&SelectStyle=%e5%8d%b3%e6%99%82%e8%bb%8d%e4%ba%8b%e5%8b%95%e6%85%8b,
257,4/15/2021,2021,4,15,5,Thursday,Fighter,J-16,2,Southwest ADIZ,,,,https://www.mnd.gov.tw/Publish.aspx?p=78487&title=%e5%9c%8b%e9%98%b2%e6%b6%88%e6%81%af&SelectStyle=%e5%8d%b3%e6%99%82%e8%bb%8d%e4%ba%8b%e5%8b%95%e6%85%8b,
258,4/16/2021,2021,4,16,6,Friday,RECCE,Y-8 RECCE,1,Southwest ADIZ,,,,https://www.mnd.gov.tw/Publish.aspx?p=78495&title=%e5%9c%8b%e9%98%b2%e6%b6%88%e6%81%af&SelectStyle=%e5%8d%b3%e6%99%82%e8%bb%8d%e4%ba%8b%e5%8b%95%e6%85%8b,
259,4/17/2021,2021,4,17,7,Saturday,Fighter,J-16,1,Southwest ADIZ,,,,https://www.mnd.gov.tw/Publish.aspx?p=78497&title=%e5%9c%8b%e9%98%b2%e6%b6%88%e6%81%af&SelectStyle=%e5%8d%b3%e6%99%82%e8%bb%8d%e4%ba%8b%e5%8b%95%e6%85%8b,
260,4/18/2021,2021,4,18,1,Sunday,ASW,Y-8 ASW,2,Southwest ADIZ,,,,https://www.mnd.gov.tw/Publish.aspx?p=78500&title=%e5%9c%8b%e9%98%b2%e6%b6%88%e6%81%af&SelectStyle=%e5%8d%b3%e6%99%82%e8%bb%8d%e4%ba%8b%e5%8b%95%e6%85%8b,
261,4/18/2021,2021,4,18,1,Sunday,RECCE,Y-8 RECCE,1,Southwest ADIZ,,,,https://www.mnd.gov.tw/Publish.aspx?p=78500&title=%e5%9c%8b%e9%98%b2%e6%b6%88%e6%81%af&SelectStyle=%e5%8d%b3%e6%99%82%e8%bb%8d%e4%ba%8b%e5%8b%95%e6%85%8b,
262,4/19/2021,2021,4,19,2,Monday,RECCE,Y-8 RECCE,1,Southwest ADIZ,,,,https://www.mnd.gov.tw/Publish.aspx?p=78520&title=%e5%9c%8b%e9%98%b2%e6%b6%88%e6%81%af&SelectStyle=%e5%8d%b3%e6%99%82%e8%bb%8d%e4%ba%8b%e5%8b%95%e6%85%8b,
263,4/20/2021,2021,4,20,3,Tuesday,Fighter,J-16,5,Southwest ADIZ,,,,https://www.mnd.gov.tw/Publish.aspx?p=78532&title=%e5%9c%8b%e9%98%b2%e6%b6%88%e6%81%af&SelectStyle=%e5%8d%b3%e6%99%82%e8%bb%8d%e4%ba%8b%e5%8b%95%e6%85%8b,
264,4/20/2021,2021,4,20,3,Tuesday,EW,Y-8 EW,1,Southwest ADIZ,,,,https://www.mnd.gov.tw/Publish.aspx?p=78532&title=%e5%9c%8b%e9%98%b2%e6%b6%88%e6%81%af&SelectStyle=%e5%8d%b3%e6%99%82%e8%bb%8d%e4%ba%8b%e5%8b%95%e6%85%8b,
265,4/20/2021,2021,4,20,3,Tuesday,RECCE,Y-8 RECCE,1,Southwest ADIZ,,,,https://www.mnd.gov.tw/Publish.aspx?p=78532&title=%e5%9c%8b%e9%98%b2%e6%b6%88%e6%81%af&SelectStyle=%e5%8d%b3%e6%99%82%e8%bb%8d%e4%ba%8b%e5%8b%95%e6%85%8b,
266,4/20/2021,2021,4,20,3,Tuesday,ASW,Y-8 ASW,2,Southwest ADIZ,,,,https://www.mnd.gov.tw/Publish.aspx?p=78532&title=%e5%9c%8b%e9%98%b2%e6%b6%88%e6%81%af&SelectStyle=%e5%8d%b3%e6%99%82%e8%bb%8d%e4%ba%8b%e5%8b%95%e6%85%8b,
267,4/21/2021,2021,4,21,4,Wednesday,RECCE,Y-8 RECCE,1,Southwest ADIZ,,,,https://www.mnd.gov.tw/Publish.aspx?p=78533&title=%e5%9c%8b%e9%98%b2%e6%b6%88%e6%81%af&SelectStyle=%e5%8d%b3%e6%99%82%e8%bb%8d%e4%ba%8b%e5%8b%95%e6%85%8b,
268,4/21/2021,2021,4,21,4,Wednesday,EW,Y-8 EW,1,Southwest ADIZ,,,,https://www.mnd.gov.tw/Publish.aspx?p=78533&title=%e5%9c%8b%e9%98%b2%e6%b6%88%e6%81%af&SelectStyle=%e5%8d%b3%e6%99%82%e8%bb%8d%e4%ba%8b%e5%8b%95%e6%85%8b,
269,4/24/2021,2021,4,24,7,Saturday,ASW,Y-8 ASW,1,Southwest ADIZ,,,,https://www.mnd.gov.tw/Publish.aspx?p=78548&title=%e5%9c%8b%e9%98%b2%e6%b6%88%e6%81%af&SelectStyle=%e5%8d%b3%e6%99%82%e8%bb%8d%e4%ba%8b%e5%8b%95%e6%85%8b,
270,4/25/2021,2021,4,25,1,Sunday,ASW,Y-8 ASW,1,Southwest ADIZ,,,,https://www.mnd.gov.tw/Publish.aspx?p=78550&title=%e5%9c%8b%e9%98%b2%e6%b6%88%e6%81%af&SelectStyle=%e5%8d%b3%e6%99%82%e8%bb%8d%e4%ba%8b%e5%8b%95%e6%85%8b,
271,4/26/2021,2021,4,26,2,Monday,EW,Y-8 EW,1,Southwest ADIZ,,,,https://www.mnd.gov.tw/Publish.aspx?p=78569&title=%e5%9c%8b%e9%98%b2%e6%b6%88%e6%81%af&SelectStyle=%e5%8d%b3%e6%99%82%e8%bb%8d%e4%ba%8b%e5%8b%95%e6%85%8b,
272,4/26/2021,2021,4,26,2,Monday,RECCE,Y-8 RECCE,1,Southwest ADIZ,,,,https://www.mnd.gov.tw/Publish.aspx?p=78569&title=%e5%9c%8b%e9%98%b2%e6%b6%88%e6%81%af&SelectStyle=%e5%8d%b3%e6%99%82%e8%bb%8d%e4%ba%8b%e5%8b%95%e6%85%8b,
273,4/30/2021,2021,4,30,6,Friday,ASW,Y-8 ASW,1,Southwest ADIZ,,,Circled around back to Southeast corner,https://www.mnd.gov.tw/Publish.aspx?p=78581&title=%e5%9c%8b%e9%98%b2%e6%b6%88%e6%81%af&SelectStyle=%e5%8d%b3%e6%99%82%e8%bb%8d%e4%ba%8b%e5%8b%95%e6%85%8b,
274,4/30/2021,2021,4,30,6,Friday,EW,Y-8 EW,1,Southwest ADIZ,,,,https://www.mnd.gov.tw/Publish.aspx?p=78581&title=%e5%9c%8b%e9%98%b2%e6%b6%88%e6%81%af&SelectStyle=%e5%8d%b3%e6%99%82%e8%bb%8d%e4%ba%8b%e5%8b%95%e6%85%8b,
275,4/30/2021,2021,4,30,6,Friday,AEW&C,KJ-500,1,Southwest ADIZ,,,,https://www.mnd.gov.tw/Publish.aspx?p=78581&title=%e5%9c%8b%e9%98%b2%e6%b6%88%e6%81%af&SelectStyle=%e5%8d%b3%e6%99%82%e8%bb%8d%e4%ba%8b%e5%8b%95%e6%85%8b,
276,4/30/2021,2021,4,30,6,Friday,Fighter,J-16,2,Southwest ADIZ,,,,https://www.mnd.gov.tw/Publish.aspx?p=78581&title=%e5%9c%8b%e9%98%b2%e6%b6%88%e6%81%af&SelectStyle=%e5%8d%b3%e6%99%82%e8%bb%8d%e4%ba%8b%e5%8b%95%e6%85%8b,
277,5/2/2021,2021,5,2,1,Sunday,RECCE,Y-8 RECCE,1,Southwest ADIZ,,,,https://www.mnd.gov.tw/Publish.aspx?p=78584&title=%e5%9c%8b%e9%98%b2%e6%b6%88%e6%81%af&SelectStyle=%e5%8d%b3%e6%99%82%e8%bb%8d%e4%ba%8b%e5%8b%95%e6%85%8b,
278,5/2/2021,2021,5,2,1,Sunday,ASW,Y-8 ASW,1,Southwest ADIZ,,,,https://www.mnd.gov.tw/Publish.aspx?p=78584&title=%e5%9c%8b%e9%98%b2%e6%b6%88%e6%81%af&SelectStyle=%e5%8d%b3%e6%99%82%e8%bb%8d%e4%ba%8b%e5%8b%95%e6%85%8b,
279,5/4/2021,2021,5,4,3,Tuesday,ASW,Y-8 ASW,1,Southwest ADIZ,,,,https://www.mnd.gov.tw/Publish.aspx?p=78593&title=%e5%9c%8b%e9%98%b2%e6%b6%88%e6%81%af&SelectStyle=%e5%8d%b3%e6%99%82%e8%bb%8d%e4%ba%8b%e5%8b%95%e6%85%8b,
280,5/6/2021,2021,5,6,5,Thursday,ASW,Y-8 ASW,1,Southwest ADIZ,,,,https://www.mnd.gov.tw/Publish.aspx?p=78600&title=%e5%9c%8b%e9%98%b2%e6%b6%88%e6%81%af&SelectStyle=%e5%8d%b3%e6%99%82%e8%bb%8d%e4%ba%8b%e5%8b%95%e6%85%8b,
281,5/7/2021,2021,5,7,6,Friday,ASW,Y-8 ASW,2,Southwest ADIZ,,,,https://www.mnd.gov.tw/Publish.aspx?p=78603&title=%e5%9c%8b%e9%98%b2%e6%b6%88%e6%81%af&SelectStyle=%e5%8d%b3%e6%99%82%e8%bb%8d%e4%ba%8b%e5%8b%95%e6%85%8b,
282,5/8/2021,2021,5,8,7,Saturday,EW,Y-8 EW,1,Southwest ADIZ,,,,https://www.mnd.gov.tw/Publish.aspx?p=78605&title=%e5%9c%8b%e9%98%b2%e6%b6%88%e6%81%af&SelectStyle=%e5%8d%b3%e6%99%82%e8%bb%8d%e4%ba%8b%e5%8b%95%e6%85%8b,
283,5/8/2021,2021,5,8,7,Saturday,ASW,Y-8 ASW,1,Southwest ADIZ,,,,https://www.mnd.gov.tw/Publish.aspx?p=78605&title=%e5%9c%8b%e9%98%b2%e6%b6%88%e6%81%af&SelectStyle=%e5%8d%b3%e6%99%82%e8%bb%8d%e4%ba%8b%e5%8b%95%e6%85%8b,
284,5/11/2021,2021,5,11,3,Tuesday,EW,Y-8 EW,1,Southwest ADIZ,,,,https://www.mnd.gov.tw/Publish.aspx?p=78612&title=%e5%9c%8b%e9%98%b2%e6%b6%88%e6%81%af&SelectStyle=%e5%8d%b3%e6%99%82%e8%bb%8d%e4%ba%8b%e5%8b%95%e6%85%8b,
285,5/12/2021,2021,5,12,4,Wednesday,ASW,Y-8 ASW,1,Southwest ADIZ,,,,https://www.mnd.gov.tw/Publish.aspx?p=78617&title=%e5%9c%8b%e9%98%b2%e6%b6%88%e6%81%af&SelectStyle=%e5%8d%b3%e6%99%82%e8%bb%8d%e4%ba%8b%e5%8b%95%e6%85%8b,
286,5/14/2021,2021,5,14,6,Friday,ASW,Y-8 ASW,1,Southwest ADIZ,,,,https://www.mnd.gov.tw/Publish.aspx?p=78627&title=%e5%9c%8b%e9%98%b2%e6%b6%88%e6%81%af&SelectStyle=%e5%8d%b3%e6%99%82%e8%bb%8d%e4%ba%8b%e5%8b%95%e6%85%8b,
287,5/14/2021,2021,5,14,6,Friday,EW,Y-8 EW,1,Southwest ADIZ,,,,https://www.mnd.gov.tw/Publish.aspx?p=78627&title=%e5%9c%8b%e9%98%b2%e6%b6%88%e6%81%af&SelectStyle=%e5%8d%b3%e6%99%82%e8%bb%8d%e4%ba%8b%e5%8b%95%e6%85%8b,
288,5/15/2021,2021,5,15,7,Saturday,RECCE,Y-8 RECCE,1,Southwest ADIZ,,,"Taiwanese civilian pilot to PLAAF pilot, ""!""  https://twitter.com/johnsfeng/status/1393520883591893000 ",https://www.mnd.gov.tw/Publish.aspx?p=78630&title=%e5%9c%8b%e9%98%b2%e6%b6%88%e6%81%af&SelectStyle=%e5%8d%b3%e6%99%82%e8%bb%8d%e4%ba%8b%e5%8b%95%e6%85%8b,
289,5/17/2021,2021,5,17,2,Monday,EW,Y-8 EW,1,Southwest ADIZ,,,,https://www.mnd.gov.tw/Publish.aspx?p=78636&title=%e5%9c%8b%e9%98%b2%e6%b6%88%e6%81%af&SelectStyle=%e5%8d%b3%e6%99%82%e8%bb%8d%e4%ba%8b%e5%8b%95%e6%85%8b,
290,5/19/2021,2021,5,19,4,Wednesday,ASW,Y-8 ASW,1,Southwest ADIZ,,,,https://www.mnd.gov.tw/Publish.aspx?p=78647&title=%e5%9c%8b%e9%98%b2%e6%b6%88%e6%81%af&SelectStyle=%e5%8d%b3%e6%99%82%e8%bb%8d%e4%ba%8b%e5%8b%95%e6%85%8b,
291,5/20/2021,2021,5,20,5,Thursday,Attack,JH-7,2,Southwest ADIZ,,,Southern tip of the median line,https://www.mnd.gov.tw/Publish.aspx?p=78651&title=%e5%9c%8b%e9%98%b2%e6%b6%88%e6%81%af&SelectStyle=%e5%8d%b3%e6%99%82%e8%bb%8d%e4%ba%8b%e5%8b%95%e6%85%8b,
292,5/20/2021,2021,5,20,5,Thursday,EW,Y-8 EW,1,Southwest ADIZ,,,,https://www.mnd.gov.tw/Publish.aspx?p=78651&title=%e5%9c%8b%e9%98%b2%e6%b6%88%e6%81%af&SelectStyle=%e5%8d%b3%e6%99%82%e8%bb%8d%e4%ba%8b%e5%8b%95%e6%85%8b,
293,5/20/2021,2021,5,20,5,Thursday,ASW,Y-8 ASW,1,Southwest ADIZ,,,Circled around back to Southeast corner,https://www.mnd.gov.tw/Publish.aspx?p=78651&title=%e5%9c%8b%e9%98%b2%e6%b6%88%e6%81%af&SelectStyle=%e5%8d%b3%e6%99%82%e8%bb%8d%e4%ba%8b%e5%8b%95%e6%85%8b,
294,5/21/2021,2021,5,21,6,Friday,Fighter,J-16,2,Southwest ADIZ,,,,https://www.mnd.gov.tw/Publish.aspx?p=78658&title=%e5%9c%8b%e9%98%b2%e6%b6%88%e6%81%af&SelectStyle=%e5%8d%b3%e6%99%82%e8%bb%8d%e4%ba%8b%e5%8b%95%e6%85%8b,
295,5/21/2021,2021,5,21,6,Friday,EW,Y-8 EW,1,Southwest ADIZ,,,,https://www.mnd.gov.tw/Publish.aspx?p=78658&title=%e5%9c%8b%e9%98%b2%e6%b6%88%e6%81%af&SelectStyle=%e5%8d%b3%e6%99%82%e8%bb%8d%e4%ba%8b%e5%8b%95%e6%85%8b,
296,5/21/2021,2021,5,21,6,Friday,ASW,Y-8 ASW,1,Southwest ADIZ,,,Circled around back to Southeast corner,https://www.mnd.gov.tw/Publish.aspx?p=78658&title=%e5%9c%8b%e9%98%b2%e6%b6%88%e6%81%af&SelectStyle=%e5%8d%b3%e6%99%82%e8%bb%8d%e4%ba%8b%e5%8b%95%e6%85%8b,
297,5/22/2021,2021,5,22,7,Saturday,ASW,Y-8 ASW,1,Southwest ADIZ,,,,https://www.mnd.gov.tw/Publish.aspx?p=78662&title=%e5%9c%8b%e9%98%b2%e6%b6%88%e6%81%af&SelectStyle=%e5%8d%b3%e6%99%82%e8%bb%8d%e4%ba%8b%e5%8b%95%e6%85%8b,
298,5/23/2021,2021,5,23,1,Sunday,ASW,Y-8 ASW,1,Southwest ADIZ,,,,https://www.mnd.gov.tw/Publish.aspx?p=78664&title=%e5%9c%8b%e9%98%b2%e6%b6%88%e6%81%af&SelectStyle=%e5%8d%b3%e6%99%82%e8%bb%8d%e4%ba%8b%e5%8b%95%e6%85%8b,
299,5/23/2021,2021,5,23,1,Sunday,EW,Y-8 EW,1,Southwest ADIZ,,,,https://www.mnd.gov.tw/Publish.aspx?p=78664&title=%e5%9c%8b%e9%98%b2%e6%b6%88%e6%81%af&SelectStyle=%e5%8d%b3%e6%99%82%e8%bb%8d%e4%ba%8b%e5%8b%95%e6%85%8b,
300,5/24/2021,2021,5,24,2,Monday,EW,Y-8 EW,1,Southwest ADIZ,,,,https://www.mnd.gov.tw/Publish.aspx?p=78667&title=%e5%9c%8b%e9%98%b2%e6%b6%88%e6%81%af&SelectStyle=%e5%8d%b3%e6%99%82%e8%bb%8d%e4%ba%8b%e5%8b%95%e6%85%8b,
301,5/26/2021,2021,5,26,4,Wednesday,AEW&C,KJ-500,1,Southwest ADIZ,,,,https://www.mnd.gov.tw/Publish.aspx?p=78674&title=%e5%9c%8b%e9%98%b2%e6%b6%88%e6%81%af&SelectStyle=%e5%8d%b3%e6%99%82%e8%bb%8d%e4%ba%8b%e5%8b%95%e6%85%8b,
302,5/28/2021,2021,5,28,6,Friday,ASW,Y-8 ASW,1,Southwest ADIZ,,,,https://www.mnd.gov.tw/Publish.aspx?p=78693&title=%e5%9c%8b%e9%98%b2%e6%b6%88%e6%81%af&SelectStyle=%e5%8d%b3%e6%99%82%e8%bb%8d%e4%ba%8b%e5%8b%95%e6%85%8b,
303,6/3/2021,2021,6,3,5,Thursday,EW,Y-8 EW,1,Southwest ADIZ,,,,https://www.mnd.gov.tw/Publish.aspx?p=78702&title=%e5%9c%8b%e9%98%b2%e6%b6%88%e6%81%af&SelectStyle=%e5%8d%b3%e6%99%82%e8%bb%8d%e4%ba%8b%e5%8b%95%e6%85%8b,
304,6/4/2021,2021,6,4,6,Friday,AEW&C,KJ-500,1,Southwest ADIZ,,,,https://www.mnd.gov.tw/Publish.aspx?p=78709&title=%e5%9c%8b%e9%98%b2%e6%b6%88%e6%81%af&SelectStyle=%e5%8d%b3%e6%99%82%e8%bb%8d%e4%ba%8b%e5%8b%95%e6%85%8b,
305,6/14/2021,2021,6,14,2,Monday,ASW,Y-8 ASW,1,Southwest ADIZ,,,,https://www.mnd.gov.tw/Publish.aspx?p=78721&title=%e5%9c%8b%e9%98%b2%e6%b6%88%e6%81%af&SelectStyle=%e5%8d%b3%e6%99%82%e8%bb%8d%e4%ba%8b%e5%8b%95%e6%85%8b,
306,6/15/2021,2021,6,15,3,Tuesday,ASW,Y-8 ASW,1,Southwest ADIZ,,,Circled around back to Southeast corner,https://www.mnd.gov.tw/Publish.aspx?p=78724&title=%e5%9c%8b%e9%98%b2%e6%b6%88%e6%81%af&SelectStyle=%e5%8d%b3%e6%99%82%e8%bb%8d%e4%ba%8b%e5%8b%95%e6%85%8b,
307,6/15/2021,2021,6,15,3,Tuesday,Bomber,H-6,4,Southwest ADIZ,,,"Two groups, circled around back to Southeast corner",https://www.mnd.gov.tw/Publish.aspx?p=78724&title=%e5%9c%8b%e9%98%b2%e6%b6%88%e6%81%af&SelectStyle=%e5%8d%b3%e6%99%82%e8%bb%8d%e4%ba%8b%e5%8b%95%e6%85%8b,
308,6/15/2021,2021,6,15,3,Tuesday,EW,Y-8 EW,1,Southwest ADIZ,,,circled around back to Southeast corner,https://www.mnd.gov.tw/Publish.aspx?p=78724&title=%e5%9c%8b%e9%98%b2%e6%b6%88%e6%81%af&SelectStyle=%e5%8d%b3%e6%99%82%e8%bb%8d%e4%ba%8b%e5%8b%95%e6%85%8b,
309,6/15/2021,2021,6,15,3,Tuesday,AEW&C,KJ-500,2,Southwest ADIZ,,,,https://www.mnd.gov.tw/Publish.aspx?p=78724&title=%e5%9c%8b%e9%98%b2%e6%b6%88%e6%81%af&SelectStyle=%e5%8d%b3%e6%99%82%e8%bb%8d%e4%ba%8b%e5%8b%95%e6%85%8b,
310,6/15/2021,2021,6,15,3,Tuesday,Fighter,J-16,14,Southwest ADIZ,,,"Two groups, four sorties circled around back to Southeast corner",https://www.mnd.gov.tw/Publish.aspx?p=78724&title=%e5%9c%8b%e9%98%b2%e6%b6%88%e6%81%af&SelectStyle=%e5%8d%b3%e6%99%82%e8%bb%8d%e4%ba%8b%e5%8b%95%e6%85%8b,
311,6/15/2021,2021,6,15,3,Tuesday,Fighter,J-11,6,Southwest ADIZ,,,,https://www.mnd.gov.tw/Publish.aspx?p=78724&title=%e5%9c%8b%e9%98%b2%e6%b6%88%e6%81%af&SelectStyle=%e5%8d%b3%e6%99%82%e8%bb%8d%e4%ba%8b%e5%8b%95%e6%85%8b,
312,6/16/2021,2021,6,16,4,Wednesday,ASW,Y-8 ASW,1,Southwest ADIZ,,,,https://www.mnd.gov.tw/Publish.aspx?p=78731&title=%e5%9c%8b%e9%98%b2%e6%b6%88%e6%81%af&SelectStyle=%e5%8d%b3%e6%99%82%e8%bb%8d%e4%ba%8b%e5%8b%95%e6%85%8b,
313,6/17/2021,2021,6,17,5,Thursday,EW,Y-8 EW,1,Southwest ADIZ,,,,https://www.mnd.gov.tw/Publish.aspx?p=78733&title=%e5%9c%8b%e9%98%b2%e6%b6%88%e6%81%af&SelectStyle=%e5%8d%b3%e6%99%82%e8%bb%8d%e4%ba%8b%e5%8b%95%e6%85%8b,
314,6/17/2021,2021,6,17,5,Thursday,Fighter,J-16,2,Southwest ADIZ,,,,https://www.mnd.gov.tw/Publish.aspx?p=78733&title=%e5%9c%8b%e9%98%b2%e6%b6%88%e6%81%af&SelectStyle=%e5%8d%b3%e6%99%82%e8%bb%8d%e4%ba%8b%e5%8b%95%e6%85%8b,
315,6/17/2021,2021,6,17,5,Thursday,Fighter,J-7,4,Southwest ADIZ,,,,https://www.mnd.gov.tw/Publish.aspx?p=78733&title=%e5%9c%8b%e9%98%b2%e6%b6%88%e6%81%af&SelectStyle=%e5%8d%b3%e6%99%82%e8%bb%8d%e4%ba%8b%e5%8b%95%e6%85%8b,
316,6/18/2021,2021,6,18,6,Friday,ASW,Y-8 ASW,1,Southwest ADIZ,,,,https://www.mnd.gov.tw/Publish.aspx?p=78737&title=%e5%9c%8b%e9%98%b2%e6%b6%88%e6%81%af&SelectStyle=%e5%8d%b3%e6%99%82%e8%bb%8d%e4%ba%8b%e5%8b%95%e6%85%8b,
317,6/19/2021,2021,6,19,7,Saturday,ASW,Y-8 ASW,1,Southwest ADIZ,,,,https://www.mnd.gov.tw/Publish.aspx?p=78739&title=%e5%9c%8b%e9%98%b2%e6%b6%88%e6%81%af&SelectStyle=%e5%8d%b3%e6%99%82%e8%bb%8d%e4%ba%8b%e5%8b%95%e6%85%8b,
318,6/20/2021,2021,6,20,1,Sunday,ASW,Y-8 ASW,1,Southwest ADIZ,,,,https://www.mnd.gov.tw/Publish.aspx?p=78741&title=%e5%9c%8b%e9%98%b2%e6%b6%88%e6%81%af&SelectStyle=%e5%8d%b3%e6%99%82%e8%bb%8d%e4%ba%8b%e5%8b%95%e6%85%8b,
319,6/26/2021,2021,6,26,7,Saturday,ASW,Y-8 ASW,1,Southwest ADIZ,,,,https://www.mnd.gov.tw/Publish.aspx?p=78766&title=%e5%9c%8b%e9%98%b2%e6%b6%88%e6%81%af&SelectStyle=%e5%8d%b3%e6%99%82%e8%bb%8d%e4%ba%8b%e5%8b%95%e6%85%8b,
320,7/2/2021,2021,7,2,6,Friday,EW,Y-8 EW,1,Southwest ADIZ,,,"Different times of day, two seperate reports",https://www.mnd.gov.tw/Publish.aspx?p=78849&title=%e5%9c%8b%e9%98%b2%e6%b6%88%e6%81%af&SelectStyle=%e5%8d%b3%e6%99%82%e8%bb%8d%e4%ba%8b%e5%8b%95%e6%85%8b,
321,7/2/2021,2021,7,2,6,Friday,ASW,Y-8 ASW,1,Southwest ADIZ,,,"Different times of day, two seperate reports",https://www.mnd.gov.tw/Publish.aspx?p=78852&title=%e5%9c%8b%e9%98%b2%e6%b6%88%e6%81%af&SelectStyle=%e5%8d%b3%e6%99%82%e8%bb%8d%e4%ba%8b%e5%8b%95%e6%85%8b,
322,7/3/2021,2021,7,3,7,Saturday,ASW,Y-8 ASW,1,Southwest ADIZ,,,,https://www.mnd.gov.tw/Publish.aspx?p=78854&title=%e5%9c%8b%e9%98%b2%e6%b6%88%e6%81%af&SelectStyle=%e5%8d%b3%e6%99%82%e8%bb%8d%e4%ba%8b%e5%8b%95%e6%85%8b,
323,7/4/2021,2021,7,4,1,Sunday,ASW,Y-8 ASW,1,Southwest ADIZ,,,,https://www.mnd.gov.tw/Publish.aspx?p=78856&title=%e5%9c%8b%e9%98%b2%e6%b6%88%e6%81%af&SelectStyle=%e5%8d%b3%e6%99%82%e8%bb%8d%e4%ba%8b%e5%8b%95%e6%85%8b,
324,7/7/2021,2021,7,7,4,Wednesday,EW,Y-8 EW,1,Southwest ADIZ,,,,https://www.mnd.gov.tw/Publish.aspx?p=78864&title=%e5%9c%8b%e9%98%b2%e6%b6%88%e6%81%af&SelectStyle=%e5%8d%b3%e6%99%82%e8%bb%8d%e4%ba%8b%e5%8b%95%e6%85%8b,
325,7/8/2021,2021,7,8,5,Thursday,EW,Y-8 EW,1,Southwest ADIZ,,,,https://www.mnd.gov.tw/Publish.aspx?p=78867&title=%e5%9c%8b%e9%98%b2%e6%b6%88%e6%81%af&SelectStyle=%e5%8d%b3%e6%99%82%e8%bb%8d%e4%ba%8b%e5%8b%95%e6%85%8b,
326,7/12/2021,2021,7,12,2,Monday,EW,Y-8 EW,1,Southwest ADIZ,,,"Different times of day, two seperate reports",https://www.mnd.gov.tw/Publish.aspx?p=78871&title=%e5%9c%8b%e9%98%b2%e6%b6%88%e6%81%af&SelectStyle=%e5%8d%b3%e6%99%82%e8%bb%8d%e4%ba%8b%e5%8b%95%e6%85%8b,
327,7/12/2021,2021,7,12,2,Monday,ASW,Y-8 ASW,1,Southwest ADIZ,,,"Different times of day, two seperate reports",https://www.mnd.gov.tw/Publish.aspx?p=78873&title=%e5%9c%8b%e9%98%b2%e6%b6%88%e6%81%af&SelectStyle=%e5%8d%b3%e6%99%82%e8%bb%8d%e4%ba%8b%e5%8b%95%e6%85%8b,
328,7/13/2021,2021,7,13,3,Tuesday,EW,Y-8 EW,1,Southwest ADIZ,,,,https://www.mnd.gov.tw/Publish.aspx?p=78877&title=%e5%9c%8b%e9%98%b2%e6%b6%88%e6%81%af&SelectStyle=%e5%8d%b3%e6%99%82%e8%bb%8d%e4%ba%8b%e5%8b%95%e6%85%8b,
329,7/13/2021,2021,7,13,3,Tuesday,RECCE,Y-8 RECCE,1,Southwest ADIZ,,,,https://www.mnd.gov.tw/Publish.aspx?p=78877&title=%e5%9c%8b%e9%98%b2%e6%b6%88%e6%81%af&SelectStyle=%e5%8d%b3%e6%99%82%e8%bb%8d%e4%ba%8b%e5%8b%95%e6%85%8b,
330,7/14/2021,2021,7,14,4,Wednesday,ASW,Y-8 ASW,1,Southwest ADIZ,,,,https://www.mnd.gov.tw/Publish.aspx?p=78880&title=%e5%9c%8b%e9%98%b2%e6%b6%88%e6%81%af&SelectStyle=%e5%8d%b3%e6%99%82%e8%bb%8d%e4%ba%8b%e5%8b%95%e6%85%8b,
331,7/15/2021,2021,7,15,5,Thursday,ASW,Y-8 ASW,1,Southwest ADIZ,,,,https://www.mnd.gov.tw/Publish.aspx?p=78884&title=%e5%9c%8b%e9%98%b2%e6%b6%88%e6%81%af&SelectStyle=%e5%8d%b3%e6%99%82%e8%bb%8d%e4%ba%8b%e5%8b%95%e6%85%8b,
332,7/21/2021,2021,7,21,4,Wednesday,ASW,Y-8 ASW,1,Southwest ADIZ,,,,https://www.mnd.gov.tw/Publish.aspx?p=78893&title=%e5%9c%8b%e9%98%b2%e6%b6%88%e6%81%af&SelectStyle=%e5%8d%b3%e6%99%82%e8%bb%8d%e4%ba%8b%e5%8b%95%e6%85%8b,
333,7/22/2021,2021,7,22,5,Thursday,ASW,Y-8 ASW,1,Southwest ADIZ,,,,https://www.mnd.gov.tw/Publish.aspx?p=78898&title=%e5%9c%8b%e9%98%b2%e6%b6%88%e6%81%af&SelectStyle=%e5%8d%b3%e6%99%82%e8%bb%8d%e4%ba%8b%e5%8b%95%e6%85%8b,
334,7/25/2021,2021,7,25,1,Sunday,ASW,Y-8 ASW,1,Southwest ADIZ,,,,https://www.mnd.gov.tw/Publish.aspx?p=78901&title=%e5%9c%8b%e9%98%b2%e6%b6%88%e6%81%af&SelectStyle=%e5%8d%b3%e6%99%82%e8%bb%8d%e4%ba%8b%e5%8b%95%e6%85%8b,
335,7/27/2021,2021,7,27,3,Tuesday,ASW,Y-8 ASW,1,Southwest ADIZ,,,,https://www.mnd.gov.tw/Publish.aspx?p=78910&title=%e5%9c%8b%e9%98%b2%e6%b6%88%e6%81%af&SelectStyle=%e5%8d%b3%e6%99%82%e8%bb%8d%e4%ba%8b%e5%8b%95%e6%85%8b,
336,7/28/2021,2021,7,28,4,Wednesday,ASW,Y-8 ASW,1,Southwest ADIZ,,,,https://www.mnd.gov.tw/Publish.aspx?p=78915&title=%e5%9c%8b%e9%98%b2%e6%b6%88%e6%81%af&SelectStyle=%e5%8d%b3%e6%99%82%e8%bb%8d%e4%ba%8b%e5%8b%95%e6%85%8b,
337,8/8/2021,2021,8,8,1,Sunday,ASW,Y-8 ASW,1,Southwest ADIZ,,,,https://www.mnd.gov.tw/Publish.aspx?p=78940&title=%e5%9c%8b%e9%98%b2%e6%b6%88%e6%81%af&SelectStyle=%e5%8d%b3%e6%99%82%e8%bb%8d%e4%ba%8b%e5%8b%95%e6%85%8b,
338,8/11/2021,2021,8,11,4,Wednesday,ELINT,Y-8 ELINT,1,Southwest ADIZ,,,,https://www.mnd.gov.tw/Publish.aspx?p=78948&title=%e5%9c%8b%e9%98%b2%e6%b6%88%e6%81%af&SelectStyle=%e5%8d%b3%e6%99%82%e8%bb%8d%e4%ba%8b%e5%8b%95%e6%85%8b,
339,8/12/2021,2021,8,12,5,Thursday,ELINT,Y-8 ELINT,1,Southwest ADIZ,,,Morning sorties--two different reports,https://www.mnd.gov.tw/Publish.aspx?p=78952&title=%e5%9c%8b%e9%98%b2%e6%b6%88%e6%81%af&SelectStyle=%e5%8d%b3%e6%99%82%e8%bb%8d%e4%ba%8b%e5%8b%95%e6%85%8b,
340,8/12/2021,2021,8,12,5,Thursday,EW,Y-8 EW,1,Southwest ADIZ,,,Morning sorties--two different reports,https://www.mnd.gov.tw/Publish.aspx?p=78952&title=%e5%9c%8b%e9%98%b2%e6%b6%88%e6%81%af&SelectStyle=%e5%8d%b3%e6%99%82%e8%bb%8d%e4%ba%8b%e5%8b%95%e6%85%8b,
341,8/12/2021,2021,8,12,5,Thursday,Fighter,J-16,4,Southwest ADIZ,,,Morning sorties--two different reports,https://www.mnd.gov.tw/Publish.aspx?p=78952&title=%e5%9c%8b%e9%98%b2%e6%b6%88%e6%81%af&SelectStyle=%e5%8d%b3%e6%99%82%e8%bb%8d%e4%ba%8b%e5%8b%95%e6%85%8b,
342,8/12/2021,2021,8,12,5,Thursday,ASW,Y-8 ASW,1,Southwest ADIZ,,,Afternoon sortie--two different reports,https://www.mnd.gov.tw/Publish.aspx?p=78960&title=%e5%9c%8b%e9%98%b2%e6%b6%88%e6%81%af&SelectStyle=%e5%8d%b3%e6%99%82%e8%bb%8d%e4%ba%8b%e5%8b%95%e6%85%8b,
343,8/15/2021,2021,8,15,1,Sunday,ASW,Y-8 ASW,1,Southwest ADIZ,,,,https://www.mnd.gov.tw/Publish.aspx?p=78967&title=%e5%9c%8b%e9%98%b2%e6%b6%88%e6%81%af&SelectStyle=%e5%8d%b3%e6%99%82%e8%bb%8d%e4%ba%8b%e5%8b%95%e6%85%8b,
344,8/16/2021,2021,8,16,2,Monday,ASW,Y-8 ASW,1,Southwest ADIZ,,,,https://www.mnd.gov.tw/Publish.aspx?p=78969&title=%e5%9c%8b%e9%98%b2%e6%b6%88%e6%81%af&SelectStyle=%e5%8d%b3%e6%99%82%e8%bb%8d%e4%ba%8b%e5%8b%95%e6%85%8b,
345,8/17/2021,2021,8,17,3,Tuesday,ASW,Y-8 ASW,1,Southwest ADIZ,,,,https://www.mnd.gov.tw/Publish.aspx?p=78969&title=%e5%9c%8b%e9%98%b2%e6%b6%88%e6%81%af&SelectStyle=%e5%8d%b3%e6%99%82%e8%bb%8d%e4%ba%8b%e5%8b%95%e6%85%8b,
346,8/17/2021,2021,8,17,3,Tuesday,EW,Y-8 EW,1,Southwest ADIZ,,,,https://www.mnd.gov.tw/Publish.aspx?p=78969&title=%e5%9c%8b%e9%98%b2%e6%b6%88%e6%81%af&SelectStyle=%e5%8d%b3%e6%99%82%e8%bb%8d%e4%ba%8b%e5%8b%95%e6%85%8b,
347,8/17/2021,2021,8,17,3,Tuesday,AEW&C,KJ-500,1,Southwest ADIZ,,,,https://www.mnd.gov.tw/Publish.aspx?p=78969&title=%e5%9c%8b%e9%98%b2%e6%b6%88%e6%81%af&SelectStyle=%e5%8d%b3%e6%99%82%e8%bb%8d%e4%ba%8b%e5%8b%95%e6%85%8b,
348,8/17/2021,2021,8,17,3,Tuesday,Fighter,J-16,6,Southwest ADIZ,,,,https://www.mnd.gov.tw/Publish.aspx?p=78969&title=%e5%9c%8b%e9%98%b2%e6%b6%88%e6%81%af&SelectStyle=%e5%8d%b3%e6%99%82%e8%bb%8d%e4%ba%8b%e5%8b%95%e6%85%8b,
349,8/17/2021,2021,8,17,3,Tuesday,Bomber,H-6K,2,Southwest ADIZ,,,,https://www.mnd.gov.tw/Publish.aspx?p=78969&title=%e5%9c%8b%e9%98%b2%e6%b6%88%e6%81%af&SelectStyle=%e5%8d%b3%e6%99%82%e8%bb%8d%e4%ba%8b%e5%8b%95%e6%85%8b,
350,8/19/2021,2021,8,19,5,Thursday,Bomber,H-6,1,Southwest ADIZ,,,,https://www.mnd.gov.tw/Publish.aspx?p=78981&title=%e5%9c%8b%e9%98%b2%e6%b6%88%e6%81%af&SelectStyle=%e5%8d%b3%e6%99%82%e8%bb%8d%e4%ba%8b%e5%8b%95%e6%85%8b,
351,8/22/2021,2021,8,22,1,Sunday,ASW,Y-8 ASW,1,Southwest ADIZ,,,,https://www.mnd.gov.tw/Publish.aspx?p=78985&title=%e5%9c%8b%e9%98%b2%e6%b6%88%e6%81%af&SelectStyle=%e5%8d%b3%e6%99%82%e8%bb%8d%e4%ba%8b%e5%8b%95%e6%85%8b,
352,8/23/2021,2021,8,23,2,Monday,ASW,Y-8 ASW,1,Southwest ADIZ,,,,https://www.mnd.gov.tw/Publish.aspx?p=78989&title=%e5%9c%8b%e9%98%b2%e6%b6%88%e6%81%af&SelectStyle=%e5%8d%b3%e6%99%82%e8%bb%8d%e4%ba%8b%e5%8b%95%e6%85%8b,
353,8/23/2021,2021,8,23,2,Monday,EW,Y-8 EW,1,Southwest ADIZ,,,,https://www.mnd.gov.tw/Publish.aspx?p=78989&title=%e5%9c%8b%e9%98%b2%e6%b6%88%e6%81%af&SelectStyle=%e5%8d%b3%e6%99%82%e8%bb%8d%e4%ba%8b%e5%8b%95%e6%85%8b,
354,8/25/2021,2021,8,25,4,Wednesday,ASW,Y-8 ASW,1,Southwest ADIZ,,,,https://www.mnd.gov.tw/Publish.aspx?p=79003&title=%e5%9c%8b%e9%98%b2%e6%b6%88%e6%81%af&SelectStyle=%e5%8d%b3%e6%99%82%e8%bb%8d%e4%ba%8b%e5%8b%95%e6%85%8b,
355,8/26/2021,2021,8,26,5,Thursday,ASW,Y-8 ASW,1,Southwest ADIZ,,,,https://www.mnd.gov.tw/Publish.aspx?p=79008&title=%e5%9c%8b%e9%98%b2%e6%b6%88%e6%81%af&SelectStyle=%e5%8d%b3%e6%99%82%e8%bb%8d%e4%ba%8b%e5%8b%95%e6%85%8b,
356,8/26/2021,2021,8,26,5,Thursday,ASW,Z-9 ASW,1,Southwest ADIZ,,,,https://www.mnd.gov.tw/Publish.aspx?p=79008&title=%e5%9c%8b%e9%98%b2%e6%b6%88%e6%81%af&SelectStyle=%e5%8d%b3%e6%99%82%e8%bb%8d%e4%ba%8b%e5%8b%95%e6%85%8b,
357,8/27/2021,2021,8,27,6,Friday,Transport,Z-8,2,Southwest ADIZ,,,,https://www.mnd.gov.tw/Publish.aspx?p=79011&title=%e5%9c%8b%e9%98%b2%e6%b6%88%e6%81%af&SelectStyle=%e5%8d%b3%e6%99%82%e8%bb%8d%e4%ba%8b%e5%8b%95%e6%85%8b,
358,8/27/2021,2021,8,27,6,Friday,ASW,Y-8 ASW,1,Southwest ADIZ,,,,https://www.mnd.gov.tw/Publish.aspx?p=79011&title=%e5%9c%8b%e9%98%b2%e6%b6%88%e6%81%af&SelectStyle=%e5%8d%b3%e6%99%82%e8%bb%8d%e4%ba%8b%e5%8b%95%e6%85%8b,
359,8/29/2021,2021,8,29,1,Sunday,RECCE,Y-8 RECCE,1,Southwest ADIZ,,,,https://www.mnd.gov.tw/Publish.aspx?p=79014&title=%e5%9c%8b%e9%98%b2%e6%b6%88%e6%81%af&SelectStyle=%e5%8d%b3%e6%99%82%e8%bb%8d%e4%ba%8b%e5%8b%95%e6%85%8b,
360,8/30/2021,2021,8,30,2,Monday,RECCE,Y-8 RECCE,1,Southwest ADIZ,,,,https://www.mnd.gov.tw/Publish.aspx?p=79016&title=%e5%9c%8b%e9%98%b2%e6%b6%88%e6%81%af&SelectStyle=%e5%8d%b3%e6%99%82%e8%bb%8d%e4%ba%8b%e5%8b%95%e6%85%8b,
361,9/1/2021,2021,9,1,4,Wednesday,RECCE,Y-8 RECCE,1,Southwest ADIZ,,,,https://www.mnd.gov.tw/Publish.aspx?p=79028&title=%e5%9c%8b%e9%98%b2%e6%b6%88%e6%81%af&SelectStyle=%e5%8d%b3%e6%99%82%e8%bb%8d%e4%ba%8b%e5%8b%95%e6%85%8b,
362,9/3/2021,2021,9,3,6,Friday,ASW,Y-8 ASW,1,Southwest ADIZ,,,,https://www.mnd.gov.tw/Publish.aspx?p=79030&title=%e5%9c%8b%e9%98%b2%e6%b6%88%e6%81%af&SelectStyle=%e5%8d%b3%e6%99%82%e8%bb%8d%e4%ba%8b%e5%8b%95%e6%85%8b,
363,9/3/2021,2021,9,3,6,Friday,Bomber,H-6K,2,Southwest ADIZ,,,,https://www.mnd.gov.tw/Publish.aspx?p=79030&title=%e5%9c%8b%e9%98%b2%e6%b6%88%e6%81%af&SelectStyle=%e5%8d%b3%e6%99%82%e8%bb%8d%e4%ba%8b%e5%8b%95%e6%85%8b,
364,9/3/2021,2021,9,3,6,Friday,ELINT,Y-8 ELINT,1,Southwest ADIZ,,,,https://www.mnd.gov.tw/Publish.aspx?p=79030&title=%e5%9c%8b%e9%98%b2%e6%b6%88%e6%81%af&SelectStyle=%e5%8d%b3%e6%99%82%e8%bb%8d%e4%ba%8b%e5%8b%95%e6%85%8b,
365,9/4/2021,2021,9,4,7,Saturday,Attack,JH-7,2,Southwest ADIZ,,,,https://www.mnd.gov.tw/Publish.aspx?p=79034&title=%e5%9c%8b%e9%98%b2%e6%b6%88%e6%81%af&SelectStyle=%e5%8d%b3%e6%99%82%e8%bb%8d%e4%ba%8b%e5%8b%95%e6%85%8b,
366,9/4/2021,2021,9,4,7,Saturday,ASW,Y-8 ASW,2,Southwest ADIZ,,,,https://www.mnd.gov.tw/Publish.aspx?p=79034&title=%e5%9c%8b%e9%98%b2%e6%b6%88%e6%81%af&SelectStyle=%e5%8d%b3%e6%99%82%e8%bb%8d%e4%ba%8b%e5%8b%95%e6%85%8b,
367,9/5/2021,2021,9,5,1,Sunday,ASW,Y-8 ASW,1,Southwest ADIZ,,,,https://www.mnd.gov.tw/Publish.aspx?p=79036&title=%e5%9c%8b%e9%98%b2%e6%b6%88%e6%81%af&SelectStyle=%e5%8d%b3%e6%99%82%e8%bb%8d%e4%ba%8b%e5%8b%95%e6%85%8b,
368,9/5/2021,2021,9,5,1,Sunday,Bomber,H-6,4,Southwest ADIZ,,,,https://www.mnd.gov.tw/Publish.aspx?p=79036&title=%e5%9c%8b%e9%98%b2%e6%b6%88%e6%81%af&SelectStyle=%e5%8d%b3%e6%99%82%e8%bb%8d%e4%ba%8b%e5%8b%95%e6%85%8b,
369,9/5/2021,2021,9,5,1,Sunday,Fighter,J-16,10,Southwest ADIZ,,,,https://www.mnd.gov.tw/Publish.aspx?p=79036&title=%e5%9c%8b%e9%98%b2%e6%b6%88%e6%81%af&SelectStyle=%e5%8d%b3%e6%99%82%e8%bb%8d%e4%ba%8b%e5%8b%95%e6%85%8b,
370,9/5/2021,2021,9,5,1,Sunday,Fighter,SU-30,4,Southwest ADIZ,,,,https://www.mnd.gov.tw/Publish.aspx?p=79036&title=%e5%9c%8b%e9%98%b2%e6%b6%88%e6%81%af&SelectStyle=%e5%8d%b3%e6%99%82%e8%bb%8d%e4%ba%8b%e5%8b%95%e6%85%8b,
371,9/6/2021,2021,9,6,2,Monday,Fighter,SU-30,2,Southwest ADIZ,,,,https://www.mnd.gov.tw/Publish.aspx?p=79041&title=%e5%9c%8b%e9%98%b2%e6%b6%88%e6%81%af&SelectStyle=%e5%8d%b3%e6%99%82%e8%bb%8d%e4%ba%8b%e5%8b%95%e6%85%8b,
372,9/6/2021,2021,9,6,2,Monday,Fighter,J-16,2,Southwest ADIZ,,,,https://www.mnd.gov.tw/Publish.aspx?p=79041&title=%e5%9c%8b%e9%98%b2%e6%b6%88%e6%81%af&SelectStyle=%e5%8d%b3%e6%99%82%e8%bb%8d%e4%ba%8b%e5%8b%95%e6%85%8b,
373,9/7/2021,2021,9,7,3,Tuesday,EW,Y-8 EW,1,Southwest ADIZ,,,,https://www.mnd.gov.tw/Publish.aspx?p=79047&title=%e5%9c%8b%e9%98%b2%e6%b6%88%e6%81%af&SelectStyle=%e5%8d%b3%e6%99%82%e8%bb%8d%e4%ba%8b%e5%8b%95%e6%85%8b,
374,9/8/2021,2021,9,8,4,Wednesday,Fighter,J-16,2,Southwest ADIZ,,,"two reports for day, morning sorties",https://www.mnd.gov.tw/Publish.aspx?p=79050&title=%e5%9c%8b%e9%98%b2%e6%b6%88%e6%81%af&SelectStyle=%e5%8d%b3%e6%99%82%e8%bb%8d%e4%ba%8b%e5%8b%95%e6%85%8b,
375,9/8/2021,2021,9,8,4,Wednesday,EW,Y-8 EW,1,Southwest ADIZ,,,"two reports for day, morning sorties",https://www.mnd.gov.tw/Publish.aspx?p=79050&title=%e5%9c%8b%e9%98%b2%e6%b6%88%e6%81%af&SelectStyle=%e5%8d%b3%e6%99%82%e8%bb%8d%e4%ba%8b%e5%8b%95%e6%85%8b,
376,9/8/2021,2021,9,8,4,Wednesday,ASW,Y-8 ASW,1,Southwest ADIZ,,,"two reports for day, afternoon sortie",https://www.mnd.gov.tw/Publish.aspx?p=79052&title=%e5%9c%8b%e9%98%b2%e6%b6%88%e6%81%af&SelectStyle=%e5%8d%b3%e6%99%82%e8%bb%8d%e4%ba%8b%e5%8b%95%e6%85%8b,
377,9/9/2021,2021,9,9,5,Thursday,ASW,Y-8 ASW,1,Southwest ADIZ,,,,https://www.mnd.gov.tw/Publish.aspx?p=79054&title=%e5%9c%8b%e9%98%b2%e6%b6%88%e6%81%af&SelectStyle=%e5%8d%b3%e6%99%82%e8%bb%8d%e4%ba%8b%e5%8b%95%e6%85%8b,
378,9/10/2021,2021,9,10,6,Friday,ASW,Y-8 ASW,1,Southwest ADIZ,,,,https://www.mnd.gov.tw/Publish.aspx?p=79057&title=%e5%9c%8b%e9%98%b2%e6%b6%88%e6%81%af&SelectStyle=%e5%8d%b3%e6%99%82%e8%bb%8d%e4%ba%8b%e5%8b%95%e6%85%8b,
379,9/11/2021,2021,9,11,7,Saturday,ASW,Y-8 ASW,1,Southwest ADIZ,,,,https://www.mnd.gov.tw/Publish.aspx?p=79061&title=%e5%9c%8b%e9%98%b2%e6%b6%88%e6%81%af&SelectStyle=%e5%8d%b3%e6%99%82%e8%bb%8d%e4%ba%8b%e5%8b%95%e6%85%8b,
380,9/12/2021,2021,9,12,1,Sunday,ASW,Y-8 ASW,1,Southwest ADIZ,,,,https://www.mnd.gov.tw/Publish.aspx?p=79064&title=%e5%9c%8b%e9%98%b2%e6%b6%88%e6%81%af&SelectStyle=%e5%8d%b3%e6%99%82%e8%bb%8d%e4%ba%8b%e5%8b%95%e6%85%8b,
381,9/13/2021,2021,9,13,2,Monday,EW,Y-8 EW,1,Southwest ADIZ,,,,https://www.mnd.gov.tw/Publish.aspx?p=79075&title=%e5%9c%8b%e9%98%b2%e6%b6%88%e6%81%af&SelectStyle=%e5%8d%b3%e6%99%82%e8%bb%8d%e4%ba%8b%e5%8b%95%e6%85%8b,
382,9/14/2021,2021,9,14,3,Tuesday,Fighter,J-16,2,Southwest ADIZ,,,,https://www.mnd.gov.tw/Publish.aspx?p=79077&title=%e5%9c%8b%e9%98%b2%e6%b6%88%e6%81%af&SelectStyle=%e5%8d%b3%e6%99%82%e8%bb%8d%e4%ba%8b%e5%8b%95%e6%85%8b,
383,9/15/2021,2021,9,15,4,Wednesday,RECCE,Y-8 RECCE,1,Southwest ADIZ,,,,https://www.mnd.gov.tw/Publish.aspx?p=79079&title=%e5%9c%8b%e9%98%b2%e6%b6%88%e6%81%af&SelectStyle=%e5%8d%b3%e6%99%82%e8%bb%8d%e4%ba%8b%e5%8b%95%e6%85%8b,
384,9/15/2021,2021,9,15,4,Wednesday,Fighter,J-16,6,Southwest ADIZ,,,,https://www.mnd.gov.tw/Publish.aspx?p=79079&title=%e5%9c%8b%e9%98%b2%e6%b6%88%e6%81%af&SelectStyle=%e5%8d%b3%e6%99%82%e8%bb%8d%e4%ba%8b%e5%8b%95%e6%85%8b,
385,9/15/2021,2021,9,15,4,Wednesday,AEW&C,KJ-500,1,Southwest ADIZ,,,,https://www.mnd.gov.tw/Publish.aspx?p=79079&title=%e5%9c%8b%e9%98%b2%e6%b6%88%e6%81%af&SelectStyle=%e5%8d%b3%e6%99%82%e8%bb%8d%e4%ba%8b%e5%8b%95%e6%85%8b,
386,9/15/2021,2021,9,15,4,Wednesday,ASW,Y-8 ASW,1,Southwest ADIZ,,,,https://www.mnd.gov.tw/Publish.aspx?p=79079&title=%e5%9c%8b%e9%98%b2%e6%b6%88%e6%81%af&SelectStyle=%e5%8d%b3%e6%99%82%e8%bb%8d%e4%ba%8b%e5%8b%95%e6%85%8b,
387,9/16/2021,2021,9,16,5,Thursday,EW,Y-8 EW,1,Southwest ADIZ,,,,https://www.mnd.gov.tw/Publish.aspx?p=79081&title=%e5%9c%8b%e9%98%b2%e6%b6%88%e6%81%af&SelectStyle=%e5%8d%b3%e6%99%82%e8%bb%8d%e4%ba%8b%e5%8b%95%e6%85%8b,
388,9/16/2021,2021,9,16,5,Thursday,Fighter,J-16,2,Southwest ADIZ,,,,https://www.mnd.gov.tw/Publish.aspx?p=79081&title=%e5%9c%8b%e9%98%b2%e6%b6%88%e6%81%af&SelectStyle=%e5%8d%b3%e6%99%82%e8%bb%8d%e4%ba%8b%e5%8b%95%e6%85%8b,
389,9/17/2021,2021,9,17,6,Friday,ASW,Y-8 ASW,1,Southwest ADIZ,,,Flew to Southeast portion,https://www.mnd.gov.tw/Publish.aspx?p=79084&title=%e5%9c%8b%e9%98%b2%e6%b6%88%e6%81%af&SelectStyle=%e5%8d%b3%e6%99%82%e8%bb%8d%e4%ba%8b%e5%8b%95%e6%85%8b,
390,9/17/2021,2021,9,17,6,Friday,RECCE,Y-8 RECCE,1,Southwest ADIZ,,,Flew to Southeast portion,https://www.mnd.gov.tw/Publish.aspx?p=79084&title=%e5%9c%8b%e9%98%b2%e6%b6%88%e6%81%af&SelectStyle=%e5%8d%b3%e6%99%82%e8%bb%8d%e4%ba%8b%e5%8b%95%e6%85%8b,
391,9/17/2021,2021,9,17,6,Friday,Fighter,J-11,2,Southwest ADIZ,,,,https://www.mnd.gov.tw/Publish.aspx?p=79084&title=%e5%9c%8b%e9%98%b2%e6%b6%88%e6%81%af&SelectStyle=%e5%8d%b3%e6%99%82%e8%bb%8d%e4%ba%8b%e5%8b%95%e6%85%8b,
392,9/17/2021,2021,9,17,6,Friday,Fighter,J-16,6,Southwest ADIZ,,,,https://www.mnd.gov.tw/Publish.aspx?p=79084&title=%e5%9c%8b%e9%98%b2%e6%b6%88%e6%81%af&SelectStyle=%e5%8d%b3%e6%99%82%e8%bb%8d%e4%ba%8b%e5%8b%95%e6%85%8b,
393,9/19/2021,2021,9,19,1,Sunday,ASW,Y-8 ASW,1,Southwest ADIZ,,,"two reports for day, morning sorties",https://www.mnd.gov.tw/Publish.aspx?p=79087&title=%e5%9c%8b%e9%98%b2%e6%b6%88%e6%81%af&SelectStyle=%e5%8d%b3%e6%99%82%e8%bb%8d%e4%ba%8b%e5%8b%95%e6%85%8b,
394,9/19/2021,2021,9,19,1,Sunday,Fighter,J-16,2,Southwest ADIZ,,,"two reports for day, morning sorties",https://www.mnd.gov.tw/Publish.aspx?p=79087&title=%e5%9c%8b%e9%98%b2%e6%b6%88%e6%81%af&SelectStyle=%e5%8d%b3%e6%99%82%e8%bb%8d%e4%ba%8b%e5%8b%95%e6%85%8b,
395,9/19/2021,2021,9,19,1,Sunday,ASW,Y-8 ASW,1,Southwest ADIZ,,,"two reports for day, afternoon sortie",https://www.mnd.gov.tw/NewUpload/202109/0919%E6%88%91%E8%A5%BF%E5%8D%97%E7%A9%BA%E5%9F%9F%E7%A9%BA%E6%83%85%E5%8B%95%E6%85%8B(%E4%B8%AD%E8%8B%B1%E6%96%87%E7%89%88)_482175.pdf,
396,9/20/2021,2021,9,20,2,Monday,ASW,Y-8 ASW,1,Southwest ADIZ,,,,https://www.mnd.gov.tw/Publish.aspx?p=79091&title=%e5%9c%8b%e9%98%b2%e6%b6%88%e6%81%af&SelectStyle=%e5%8d%b3%e6%99%82%e8%bb%8d%e4%ba%8b%e5%8b%95%e6%85%8b,
397,9/22/2021,2021,9,22,4,Wednesday,EW,Y-8 EW,1,Southwest ADIZ,,,,https://www.mnd.gov.tw/Publish.aspx?p=79094&title=%e5%9c%8b%e9%98%b2%e6%b6%88%e6%81%af&SelectStyle=%e5%8d%b3%e6%99%82%e8%bb%8d%e4%ba%8b%e5%8b%95%e6%85%8b,
398,9/22/2021,2021,9,22,4,Wednesday,ASW,Y-8 ASW,1,Southwest ADIZ,,,,https://www.mnd.gov.tw/Publish.aspx?p=79094&title=%e5%9c%8b%e9%98%b2%e6%b6%88%e6%81%af&SelectStyle=%e5%8d%b3%e6%99%82%e8%bb%8d%e4%ba%8b%e5%8b%95%e6%85%8b,
399,9/23/2021,2021,9,23,5,Thursday,Fighter,J-16,12,Southwest ADIZ,,,"two reports for day, morning sorties",https://www.mnd.gov.tw/Publish.aspx?p=79096&title=%e5%9c%8b%e9%98%b2%e6%b6%88%e6%81%af&SelectStyle=%e5%8d%b3%e6%99%82%e8%bb%8d%e4%ba%8b%e5%8b%95%e6%85%8b,
400,9/23/2021,2021,9,23,5,Thursday,ASW,Y-8 ASW,2,Southwest ADIZ,,,"two reports for day, morning sorties; flew to Southeast portion",https://www.mnd.gov.tw/Publish.aspx?p=79096&title=%e5%9c%8b%e9%98%b2%e6%b6%88%e6%81%af&SelectStyle=%e5%8d%b3%e6%99%82%e8%bb%8d%e4%ba%8b%e5%8b%95%e6%85%8b,
401,9/23/2021,2021,9,23,5,Thursday,Bomber,H-6,2,Southwest ADIZ,,,"two reports for day, morning sorties; flew to Southeast portion",https://www.mnd.gov.tw/Publish.aspx?p=79096&title=%e5%9c%8b%e9%98%b2%e6%b6%88%e6%81%af&SelectStyle=%e5%8d%b3%e6%99%82%e8%bb%8d%e4%ba%8b%e5%8b%95%e6%85%8b,
402,9/23/2021,2021,9,23,5,Thursday,EW,Y-8 EW,1,Southwest ADIZ,,,"two reports for day, morning sorties; flew to Southeast portion",https://www.mnd.gov.tw/Publish.aspx?p=79096&title=%e5%9c%8b%e9%98%b2%e6%b6%88%e6%81%af&SelectStyle=%e5%8d%b3%e6%99%82%e8%bb%8d%e4%ba%8b%e5%8b%95%e6%85%8b,
403,9/23/2021,2021,9,23,5,Thursday,Fighter,J-11,2,Southwest ADIZ,,,"two reports for day, morning sorties",https://www.mnd.gov.tw/Publish.aspx?p=79096&title=%e5%9c%8b%e9%98%b2%e6%b6%88%e6%81%af&SelectStyle=%e5%8d%b3%e6%99%82%e8%bb%8d%e4%ba%8b%e5%8b%95%e6%85%8b,
404,9/23/2021,2021,9,23,5,Thursday,Fighter,J-16,2,Southwest ADIZ,,,"two reports for day, afternoon sorties",https://www.mnd.gov.tw/Publish.aspx?p=79098&title=%e5%9c%8b%e9%98%b2%e6%b6%88%e6%81%af&SelectStyle=%e5%8d%b3%e6%99%82%e8%bb%8d%e4%ba%8b%e5%8b%95%e6%85%8b,
405,9/23/2021,2021,9,23,5,Thursday,AEW&C,KJ-500,1,Southwest ADIZ,,,"two reports for day, afternoon sorties",https://www.mnd.gov.tw/Publish.aspx?p=79098&title=%e5%9c%8b%e9%98%b2%e6%b6%88%e6%81%af&SelectStyle=%e5%8d%b3%e6%99%82%e8%bb%8d%e4%ba%8b%e5%8b%95%e6%85%8b,
406,9/23/2021,2021,9,23,5,Thursday,Fighter,J-11,2,Southwest ADIZ,,,"two reports for day, afternoon sorties",https://www.mnd.gov.tw/Publish.aspx?p=79098&title=%e5%9c%8b%e9%98%b2%e6%b6%88%e6%81%af&SelectStyle=%e5%8d%b3%e6%99%82%e8%bb%8d%e4%ba%8b%e5%8b%95%e6%85%8b,
407,9/24/2021,2021,9,24,6,Friday,EW,Y-8 EW,1,Southwest ADIZ,,,,https://www.mnd.gov.tw/Publish.aspx?p=79100&title=%e5%9c%8b%e9%98%b2%e6%b6%88%e6%81%af&SelectStyle=%e5%8d%b3%e6%99%82%e8%bb%8d%e4%ba%8b%e5%8b%95%e6%85%8b,
408,9/24/2021,2021,9,24,6,Friday,Fighter,J-16,2,Southwest ADIZ,,,,https://www.mnd.gov.tw/Publish.aspx?p=79100&title=%e5%9c%8b%e9%98%b2%e6%b6%88%e6%81%af&SelectStyle=%e5%8d%b3%e6%99%82%e8%bb%8d%e4%ba%8b%e5%8b%95%e6%85%8b,
409,9/25/2021,2021,9,25,7,Saturday,ASW,Y-8 ASW,1,Southwest ADIZ,,,,https://www.mnd.gov.tw/Publish.aspx?p=79103&title=%e5%9c%8b%e9%98%b2%e6%b6%88%e6%81%af&SelectStyle=%e5%8d%b3%e6%99%82%e8%bb%8d%e4%ba%8b%e5%8b%95%e6%85%8b,
410,9/26/2021,2021,9,26,1,Sunday,RECCE,Y-8 RECCE,1,Southwest ADIZ,,,"two reports for day, morning sortie",https://www.mnd.gov.tw/Publish.aspx?p=79105&title=%e5%9c%8b%e9%98%b2%e6%b6%88%e6%81%af&SelectStyle=%e5%8d%b3%e6%99%82%e8%bb%8d%e4%ba%8b%e5%8b%95%e6%85%8b,
411,9/26/2021,2021,9,26,1,Sunday,ASW,Y-8 ASW,1,Southwest ADIZ,,,"two reports for day, afternoon sortie",https://www.mnd.gov.tw/Publish.aspx?p=79107&title=%e5%9c%8b%e9%98%b2%e6%b6%88%e6%81%af&SelectStyle=%e5%8d%b3%e6%99%82%e8%bb%8d%e4%ba%8b%e5%8b%95%e6%85%8b,
412,9/27/2021,2021,9,27,2,Monday,EW,Y-8 EW,1,Southwest ADIZ,,,,https://www.mnd.gov.tw/Publish.aspx?p=79110&title=%e5%9c%8b%e9%98%b2%e6%b6%88%e6%81%af&SelectStyle=%e5%8d%b3%e6%99%82%e8%bb%8d%e4%ba%8b%e5%8b%95%e6%85%8b,
413,9/27/2021,2021,9,27,2,Monday,EW,Y-9 EW,1,Southwest ADIZ,,,Flew to Southeast portion,https://www.mnd.gov.tw/Publish.aspx?p=79110&title=%e5%9c%8b%e9%98%b2%e6%b6%88%e6%81%af&SelectStyle=%e5%8d%b3%e6%99%82%e8%bb%8d%e4%ba%8b%e5%8b%95%e6%85%8b,
414,9/27/2021,2021,9,27,2,Monday,Fighter,J-16,2,Southwest ADIZ,,,,https://www.mnd.gov.tw/Publish.aspx?p=79110&title=%e5%9c%8b%e9%98%b2%e6%b6%88%e6%81%af&SelectStyle=%e5%8d%b3%e6%99%82%e8%bb%8d%e4%ba%8b%e5%8b%95%e6%85%8b,
415,9/27/2021,2021,9,27,2,Monday,AEW&C,KJ-500,1,Southwest ADIZ,,,,https://www.mnd.gov.tw/Publish.aspx?p=79110&title=%e5%9c%8b%e9%98%b2%e6%b6%88%e6%81%af&SelectStyle=%e5%8d%b3%e6%99%82%e8%bb%8d%e4%ba%8b%e5%8b%95%e6%85%8b,
416,9/27/2021,2021,9,27,2,Monday,ASW,Y-8 ASW,1,Southwest ADIZ,82016.0,,,https://www.mnd.gov.tw/Publish.aspx?p=79110&title=%e5%9c%8b%e9%98%b2%e6%b6%88%e6%81%af&SelectStyle=%e5%8d%b3%e6%99%82%e8%bb%8d%e4%ba%8b%e5%8b%95%e6%85%8b,
417,9/28/2021,2021,9,28,3,Tuesday,EW,Y-8 EW,1,Southwest ADIZ,,,,https://www.mnd.gov.tw/Publish.aspx?p=79112&title=%e5%9c%8b%e9%98%b2%e6%b6%88%e6%81%af&SelectStyle=%e5%8d%b3%e6%99%82%e8%bb%8d%e4%ba%8b%e5%8b%95%e6%85%8b,
418,9/28/2021,2021,9,28,3,Tuesday,ASW,Y-8 ASW,1,Southwest ADIZ,,,,https://www.mnd.gov.tw/Publish.aspx?p=79112&title=%e5%9c%8b%e9%98%b2%e6%b6%88%e6%81%af&SelectStyle=%e5%8d%b3%e6%99%82%e8%bb%8d%e4%ba%8b%e5%8b%95%e6%85%8b,
419,9/29/2021,2021,9,29,4,Wednesday,Fighter,J-16,4,Southwest ADIZ,,,,https://www.mnd.gov.tw/Publish.aspx?p=79115&title=%e5%9c%8b%e9%98%b2%e6%b6%88%e6%81%af&SelectStyle=%e5%8d%b3%e6%99%82%e8%bb%8d%e4%ba%8b%e5%8b%95%e6%85%8b,
420,9/29/2021,2021,9,29,4,Wednesday,EW,Y-8 EW,1,Southwest ADIZ,,,,https://www.mnd.gov.tw/Publish.aspx?p=79115&title=%e5%9c%8b%e9%98%b2%e6%b6%88%e6%81%af&SelectStyle=%e5%8d%b3%e6%99%82%e8%bb%8d%e4%ba%8b%e5%8b%95%e6%85%8b,
421,9/30/2021,2021,9,30,5,Thursday,ASW,Y-8 ASW,1,Southwest ADIZ,,,,https://www.mnd.gov.tw/Publish.aspx?p=79125&title=%e5%9c%8b%e9%98%b2%e6%b6%88%e6%81%af&SelectStyle=%e5%8d%b3%e6%99%82%e8%bb%8d%e4%ba%8b%e5%8b%95%e6%85%8b,
422,10/1/2021,2021,10,1,6,Friday,Fighter,J-16,18,Southwest ADIZ,,,"two reports for day, day sorties; https://www.globaltimes.cn/page/202110/1235605.shtml ",https://www.mnd.gov.tw/Publish.aspx?p=79127&title=%e5%9c%8b%e9%98%b2%e6%b6%88%e6%81%af&SelectStyle=%e5%8d%b3%e6%99%82%e8%bb%8d%e4%ba%8b%e5%8b%95%e6%85%8b,
423,10/1/2021,2021,10,1,6,Friday,Fighter,SU-30,4,Southwest ADIZ,,,"two reports for day, day sorties; https://www.globaltimes.cn/page/202110/1235605.shtml ",https://www.mnd.gov.tw/Publish.aspx?p=79127&title=%e5%9c%8b%e9%98%b2%e6%b6%88%e6%81%af&SelectStyle=%e5%8d%b3%e6%99%82%e8%bb%8d%e4%ba%8b%e5%8b%95%e6%85%8b,
424,10/1/2021,2021,10,1,6,Friday,Bomber,H-6,2,Southwest ADIZ,,,"two reports for day, day sorties; https://www.globaltimes.cn/page/202110/1235605.shtml ",https://www.mnd.gov.tw/Publish.aspx?p=79127&title=%e5%9c%8b%e9%98%b2%e6%b6%88%e6%81%af&SelectStyle=%e5%8d%b3%e6%99%82%e8%bb%8d%e4%ba%8b%e5%8b%95%e6%85%8b,
425,10/1/2021,2021,10,1,6,Friday,ASW,Y-8 ASW,1,Southwest ADIZ,,,"two reports for day, day sorties; https://www.globaltimes.cn/page/202110/1235605.shtml ",https://www.mnd.gov.tw/Publish.aspx?p=79127&title=%e5%9c%8b%e9%98%b2%e6%b6%88%e6%81%af&SelectStyle=%e5%8d%b3%e6%99%82%e8%bb%8d%e4%ba%8b%e5%8b%95%e6%85%8b,
426,10/1/2021,2021,10,1,6,Friday,Fighter,J-16,10,Southwest ADIZ,,Night,"two reports for day, night sorties; flew to Southeast portion https://www.globaltimes.cn/page/202110/1235605.shtml",https://www.mnd.gov.tw/Publish.aspx?p=79129&title=%e5%9c%8b%e9%98%b2%e6%b6%88%e6%81%af&SelectStyle=%e5%8d%b3%e6%99%82%e8%bb%8d%e4%ba%8b%e5%8b%95%e6%85%8b,
427,10/1/2021,2021,10,1,6,Friday,Bomber,H-6,2,Southwest ADIZ,,Night,"two reports for day, night sorties; flew to Southeast portionhttps://www.globaltimes.cn/page/202110/1235605.shtml",https://www.mnd.gov.tw/Publish.aspx?p=79129&title=%e5%9c%8b%e9%98%b2%e6%b6%88%e6%81%af&SelectStyle=%e5%8d%b3%e6%99%82%e8%bb%8d%e4%ba%8b%e5%8b%95%e6%85%8b,
